https://www.sewakost.com/jakarta/selatan/kos-28k-upn-pondoklabu-38459.html	KOS 28K UPN PONDOKLABU	1300000	Kost Putri	GG. KRAMAT NO.28K, JL. KRAMAT, PANGKALANJATI (BELAKANG KAMPUS UPN PONDOKLABU)	Ya	Ya	Ya	Ya	Ya	Tidak	Tidak	Tidak	Tidak	Ya	Tidak	Tidak	Tidak	Tidak	Tidak	Tidak	Tidak	Tidak	Tidak
https://www.sewakost.com/jakarta/selatan/kos-a21-pondoklabu-38454.html	KOS A21 PONDOKLABU	1500000	Kost Putri	THE HEIGHT PONDOKLABU RESIDENCE, KAV. A21, JL. KRAMAT, PANGKALANJATI (BELAKANG KAMPUS UPN PONDOKLABU)	Ya	Ya	Ya	Ya	Ya	Tidak	Tidak	Tidak	Ya	Ya	Tidak	Tidak	Tidak	Ya	Tidak	Ya	Tidak	Tidak	Tidak
https://www.sewakost.com/jakarta/selatan/kost-murah-di-jatipadang-poncol-tb-simatupang-jaksel-38422.html	Kost murah di Jatipadang Poncol TB Simatupang Jaksel	800000	Kost Campur	Jl. Jati Padang Poncol RT.006 RW.008 No.7 (Jl. PONCOL XII) Kel. Jatipadang, Kec. Pasar Minggu Jaksel (Samping SMPN 218 Jaksel)	Ya	Ya	Tidak	Ya	Tidak	Ya	Tidak	Tidak	Ya	Ya	Tidak	Tidak	Ya	Tidak	Tidak	Tidak	Tidak	Tidak	Tidak
https://www.sewakost.com/jakarta/selatan/kost-raja-tebu-kebayoran-lama-jakarta-selatan-38419.html	Kost Raja Tebu, Kebayoran Lama, Jakarta Selatan	1550000	Kost Campur	Jl. Rawa Simprug IX No. 21,23 Kebayoran Lama, Jakarta Selatan	Ya	Ya	Ya	Tidak	Ya	Ya	Tidak	Tidak	Ya	Ya	Tidak	Tidak	Tidak	Tidak	Tidak	Ya	Tidak	Tidak	Tidak
https://www.sewakost.com/jakarta/selatan/kost-eksklusif-nice-stay-di-tebet-jakarta-selatan-38159.html	KOST EKSKLUSIF NICE STAY DI TEBET JAKARTA SELATAN	1900000	Kost Campur	Jl. F No.16, RT.7/RW.8, Kb. Baru, Kec. Tebet, Kota Jakarta Selatan, Daerah Khusus Ibukota Jakarta 12830	Ya	Ya	Ya	Ya	Ya	Tidak	Tidak	Tidak	Ya	Ya	Ya	Ya	Ya	Ya	Tidak	Ya	Tidak	Tidak	Ya
https://www.sewakost.com/jakarta/selatan/kosan-khusus-wanita-muslimah-38087.html	Kosan Khusus Wanita Muslimah	1000000	Kost Putri	Jl. Warung Jati Barat Gg. Masjid Assalafiyah RT.004 RW.005 No.48 C Jakarta Sekatan Seberang RS. JMC	Tidak	Tidak	Ya	Tidak	Tidak	Tidak	Tidak	Tidak	Tidak	Tidak	Tidak	Tidak	Tidak	Tidak	Tidak	Tidak	Tidak	Tidak	Tidak
https://www.sewakost.com/jakarta/selatan/kost-ac-pria-wanita-kos-kosan-indekos-indekost-setia-budi-jaksel-38024.html	KOST AC PRIA WANITA KOS KOSAN INDEKOS INDEKOST - SETIA BUDI, JAKSEL	1000000	Kost Campur	Jalan Menteng Wadas Timur No 7, Pasar Manggis, Setia Budi, Jakarta Selatan	Ya	Ya	Ya	Tidak	Ya	Tidak	Tidak	Tidak	Ya	Ya	Tidak	Tidak	Ya	Tidak	Ya	Tidak	Tidak	Tidak	Tidak
https://www.sewakost.com/jakarta/selatan/d-manzado-town-house-27186.html	D'MANZADO TOWN HOUSE	3500000	Kost Campur	Jl. Jati padang poncol pasar minggi	Ya	Ya	Ya	Ya	Tidak	Ya	Ya	Ya	Ya	Ya	Ya	Ya	Ya	Ya	Ya	Ya	Ya	Tidak	Tidak
https://www.sewakost.com/jakarta/selatan/d-green-mansion-37984.html	D Green Mansion	1500000	Kost Campur	Jalan blumbang no 90 b karet pedurenan setiabudi jaksel	Ya	Ya	Ya	Ya	Ya	Ya	Ya	Ya	Ya	Ya	Ya	Ya	Ya	Ya	Ya	Ya	Ya	Ya	Ya
https://www.sewakost.com/jakarta/selatan/kost-karyawan-amp-karyawati-37954.html	Kost karyawan & karyawati	850000	Kost Campur	Jl. Bangka gang amal 3. pasar kecil. Rt.013/05. Pela mampang jakarta selatan	Tidak	Tidak	Ya	Ya	Ya	Tidak	Tidak	Tidak	Tidak	Ya	Tidak	Tidak	Tidak	Tidak	Tidak	Tidak	Tidak	Tidak	Tidak
https://www.sewakost.com/jakarta/selatan/kost-karyawan-amp-karyawati-37949.html	Kost karyawan & karyawati	1000000	Kost Campur	Jl. Bangka gang amal 3. pasar kecil. Rt.013/05. Pela mampang jakarta selatan	Ya	Tidak	Ya	Ya	Ya	Tidak	Tidak	Tidak	Tidak	Ya	Tidak	Tidak	Tidak	Tidak	Tidak	Tidak	Tidak	Tidak	Tidak
https://www.sewakost.com/jakarta/selatan/kost-setiabudi-karet-kuningan-bek-murad-tashi-deley-37888.html	Kost Setiabudi Karet Kuningan Bek Murad Tashi Deley	1900000	Kost Campur	Jl. Bek Murad No. 30, Setiabudi, Karet kuningan, Jakarta Selatan	Ya	Ya	Ya	Ya	Ya	Ya	Ya	Tidak	Ya	Ya	Ya	Tidak	Ya	Ya	Ya	Tidak	Ya	Ya	Tidak
https://www.sewakost.com/jakarta/selatan/the-residence-tanjung-barat-exclusive-kost-37815.html	The Residence Tanjung Barat - Exclusive kost	1900000	Kost Campur	Jl. H. Saidi nmr 8 B - Tanjung Barat - persis di belakang gedung Antam	Ya	Ya	Ya	Ya	Ya	Tidak	Tidak	Tidak	Ya	Ya	Ya	Ya	Ya	Tidak	Ya	Ya	Ya	Tidak	Ya
https://www.sewakost.com/jakarta/selatan/kost-pria-mampang-prapatan-gratis-laundry-37734.html	KOST PRIA MAMPANG PRAPATAN GRATIS LAUNDRY	1250000	Kost Putra	Jl. Mampang Prapatan X NO 30 Jak-Sel	Tidak	Tidak	Ya	Ya	Tidak	Tidak	Tidak	Tidak	Ya	Ya	Tidak	Tidak	Tidak	Ya	Tidak	Tidak	Ya	Tidak	Tidak
https://www.sewakost.com/jakarta/selatan/kost-pria-mampang-prapatan-gratis-cuci-baju-amp-wifi-37733.html	Kost Pria Mampang Prapatan  GRATIS CUCI BAJU & WIFI	950000	Kost Putra	Jl. Mampang Prapatan X NO 30 Jak-Sel	Tidak	Ya	Tidak	Ya	Tidak	Tidak	Tidak	Tidak	Ya	Ya	Tidak	Tidak	Tidak	Ya	Tidak	Tidak	Tidak	Tidak	Tidak
https://www.sewakost.com/jakarta/selatan/kost-the-view-leblus-furnished-pool-cilandak-jaksel-37590.html	Kost The View LeBlus, furnished, pool, Cilandak, Jaksel	2900000	Kost Campur	Jl. Taman Lebak Bulus IV Blok H-12, RT.14/RW.7 Lb. Bulus, RT.10/RW.7, Lebak Bulus, Cilandak, RT.10/RW.7, Lebak Bulus, Cilandak, South Jakarta City, Jakarta 12440, Indonesia	Ya	Ya	Ya	Ya	Ya	Ya	Ya	Tidak	Ya	Ya	Ya	Ya	Ya	Ya	Ya	Ya	Tidak	Tidak	Ya
https://www.sewakost.com/jakarta/selatan/kost-wanita-belakang-scbd-37556.html	Kost wanita belakang SCBD	2500000	Kost Putri	Jl kebalen VI /30  Kebayoran Baru Jkt Sel  tlp 081212777863	Ya	Ya	Ya	Ya	Ya	Ya	Ya	Tidak	Tidak	Tidak	Tidak	Ya	Tidak	Tidak	Tidak	Tidak	Tidak	Tidak	Tidak
https://www.sewakost.com/jakarta/selatan/kyty-house-37415.html	Kyty House	1100000	Kost Putri	Jl. Tabah No. 43, grogol selatan, kebayoran lama	Ya	Ya	Ya	Ya	Tidak	Tidak	Tidak	Tidak	Tidak	Tidak	Ya	Tidak	Ya	Ya	Tidak	Tidak	Tidak	Tidak	Tidak
https://www.sewakost.com/jakarta/selatan/kost-bulanan-mampang-prapatan-air-bebas-kamar-mandi-dalam-37396.html	Kost Bulanan Mampang Prapatan, air bebas, kamar mandi dalam	850000	Kost Campur	Jalan Mampang Prapatan 9 No. 1 RT 7/10 Tegal Parang, Mampang Prapatan	Tidak	Tidak	Ya	Tidak	Tidak	Tidak	Tidak	Tidak	Tidak	Ya	Tidak	Tidak	Tidak	Tidak	Tidak	Tidak	Tidak	Tidak	Tidak
https://www.sewakost.com/jakarta/selatan/kos-putra-dekat-mrt-pasar-blok-a-37223.html	Kos putra dekat MRT pasar blok A	800000	Kost Putra	jalan ketimun 3 no 173 Keb baru jaksel	Tidak	Tidak	Tidak	Tidak	Tidak	Tidak	Tidak	Tidak	Tidak	Tidak	Tidak	Tidak	Tidak	Tidak	Tidak	Tidak	Tidak	Tidak	Tidak
https://www.sewakost.com/jakarta/selatan/k19-residence-kos-37207.html	K19 Residence Kos	1849000	Kost Putri	Taman Graha Indah jln pangkalan jati 2 Pondok Labu - Jaksel	Ya	Ya	Ya	Ya	Ya	Tidak	Tidak	Ya	Ya	Ya	Tidak	Tidak	Ya	Tidak	Tidak	Tidak	Tidak	Tidak	Tidak
https://www.sewakost.com/jakarta/selatan/kos-khusus-putri-25-36889.html	Kos Khusus PUTRI 25	850000	Kost Putri	Jl Menteng Atas Barat 25	Tidak	Ya	Tidak	Tidak	Tidak	Tidak	Tidak	Tidak	Tidak	Ya	Ya	Tidak	Ya	Tidak	Tidak	Tidak	Tidak	Tidak	Tidak
https://www.sewakost.com/jakarta/selatan/kos-mampang-kemang-36329.html	Kos Mampang-Kemang	1800000	Kost Campur	Jl. mampang prapatan XVI no,24 jakarta selatan	Ya	Ya	Ya	Ya	Tidak	Tidak	Tidak	Tidak	Tidak	Tidak	Tidak	Tidak	Tidak	Tidak	Tidak	Tidak	Tidak	Tidak	Tidak
https://www.sewakost.com/jakarta/selatan/tersedia-kamar-kost-36320.html	Tersedia kamar kost	2200000	Kost Campur	Komplek IKPN No. G18, RT 005, RW 004, Kel. Bintaro, kec. Pesanggrahan Jaksel, 12330.	Ya	Ya	Ya	Ya	Tidak	Tidak	Tidak	Tidak	Ya	Ya	Ya	Ya	Ya	Tidak	Tidak	Tidak	Tidak	Ya	Ya
https://www.sewakost.com/jakarta/selatan/kos-putri-jalan-n-kebon-baru-tebet-36314.html	Kos Putri Jalan N, Kebon Baru, Tebet	1200000	Kost Putri	Jl. N No. 28, Asem Baris Raya, Kebon Baru, Tebet	Ya	Ya	Ya	Ya	Ya	Tidak	Ya	Ya	Ya	Ya	Ya	Tidak	Ya	Tidak	Tidak	Tidak	Tidak	Tidak	Tidak
https://www.sewakost.com/jakarta/selatan/kost-asri-putri-pancoran-35938.html	Kost asri putri pancoran	1500000	Kost Putri	Jl.cikoko barat 1 gg II no 27 Rt 007 Rw 04 kelurahan cikoko kecamatan Pancoran Jaksel	Ya	Ya	Ya	Ya	Ya	Tidak	Tidak	Ya	Ya	Ya	Tidak	Tidak	Ya	Ya	Tidak	Tidak	Tidak	Tidak	Tidak
https://www.sewakost.com/jakarta/selatan/kost-griya-nafizka-35557.html	KOST GRIYA NAFIZKA	3750000	Kost Pasutri	Jl. Radio V No.4, RT.2/RW.4, Kramat Pela, Kec. Kby. Baru, Kota Jakarta Selatan, Daerah Khusus Ibukota Jakarta 12130, Indonesia	Ya	Ya	Ya	Ya	Tidak	Ya	Tidak	Ya	Ya	Ya	Ya	Tidak	Ya	Tidak	Ya	Ya	Tidak	Tidak	Ya
https://www.sewakost.com/jakarta/selatan/hj-uun-kost-kost-an-kontrakan-kos-kosan-indekos-harian-bulanan-34810.html	HJ. UUN Kost, Kost-an, Kontrakan, Kos, Kosan, Indekos, Harian-Bulanan	1800000	Kost Campur	Jln. Nangka Raya No.14 RT.05 RW.05 Tanjung Barat, Jagakarsa, Jakarta Selatan, DKI Jakarta 12530	Ya	Ya	Ya	Ya	Ya	Tidak	Tidak	Ya	Ya	Ya	Ya	Tidak	Ya	Tidak	Tidak	Ya	Ya	Tidak	Tidak
https://www.sewakost.com/jakarta/selatan/guesthouse-indonesia-jakarta-semi-apartment-room-34733.html	Guesthouse Indonesia Jakarta semi apartment room	2800000	Kost Campur	Jalan Gunung Balong Raya no 10 Lebak Bulus Cilandak	Ya	Ya	Ya	Ya	Tidak	Tidak	Tidak	Tidak	Ya	Ya	Ya	Tidak	Ya	Ya	Tidak	Ya	Ya	Ya	Tidak
https://www.sewakost.com/jakarta/selatan/guesthouse-indonesia-jakarta-deluxe-room-34732.html	Guesthouse Indonesia Jakarta deluxe room	2700000	Kost Campur	Jalan Gunung Balong Raya no 10 Lebak Bulus 3 Cilandak	Ya	Ya	Ya	Ya	Tidak	Tidak	Tidak	Ya	Ya	Ya	Ya	Ya	Ya	Ya	Tidak	Ya	Ya	Ya	Tidak
https://www.sewakost.com/jakarta/selatan/kost-khusus-karyawan-pria-di-tempat-strategis-tebet-belakang-univ-sahid-20609.html	KOST KHUSUS KARYAWAN (PRIA) DI TEMPAT STRATEGIS (TEBET, Belakang Univ. Sahid)	1500000	Kost Putra	JL. MASJID ANNUR, MENTENG DALAM  - TEBET	Ya	Ya	Ya	Ya	Ya	Tidak	Tidak	Tidak	Tidak	Ya	Ya	Tidak	Tidak	Tidak	Tidak	Tidak	Tidak	Tidak	Tidak
https://www.sewakost.com/jakarta/selatan/one-bedroom-34600.html	One Bedroom	1600000	Kost Campur	Jl. Pengadegan Barat XIII no.17B, Pancoran, Jakarta Selatan	Ya	Ya	Ya	Ya	Ya	Tidak	Tidak	Ya	Ya	Ya	Ya	Ya	Ya	Ya	Ya	Ya	Tidak	Tidak	Ya
https://www.sewakost.com/jakarta/selatan/kos-muslimah-medikost-ciputat-tanggerang-selatan-34467.html	Kos muslimah MEDIKOST ciputat, tanggerang selatan	1050000	Kost Putri	Jalan tarumanegara no 67F cirendeu, ciputat timur, tanggerang selatan	Tidak	Ya	Ya	Ya	Tidak	Tidak	Tidak	Ya	Ya	Ya	Ya	Tidak	Ya	Tidak	Tidak	Tidak	Tidak	Tidak	Tidak
https://www.sewakost.com/jakarta/selatan/guest-house-kos-kost-kalibata-newly-renovated-34421.html	Guest House Kos Kost Kalibata (Newly Renovated)	2000000	Kost Campur	Jl. Kalibata Raya no.2 (sebelum flyover Kalibata-DewiSartika), Kalibata, Rawajati, Pancoran, Jakarta Selatan	Ya	Ya	Ya	Ya	Ya	Ya	Tidak	Tidak	Ya	Ya	Tidak	Tidak	Ya	Tidak	Ya	Ya	Tidak	Tidak	Tidak
https://www.sewakost.com/jakarta/selatan/kost-murah-pakubuwono-jakarta-selatan-34262.html	Kost Murah Pakubuwono - Jakarta Selatan 	1600000	Kost Campur	Kost Pakubuwono Jalan Abdul Rahman 1 NO.8, RW.1, Kebayoran Lama Utara, Kecamatan Kebayoran Lama Kota Jakarta Selatan, DKI Jakarta 12220 Indonesia	Ya	Ya	Ya	Tidak	Tidak	Tidak	Tidak	Tidak	Ya	Ya	Ya	Tidak	Tidak	Tidak	Tidak	Tidak	Tidak	Tidak	Tidak
https://www.sewakost.com/jakarta/selatan/guesthouse-kos-jakarta-retro-vintage-cilandak-lebak-bulus-34150.html	Guesthouse Kos Jakarta Retro Vintage Cilandak Lebak Bulus	2600000	Kost Campur	Jalan Gunung Balong raya no 10 Lebak Bulus 3 Cilandak	Ya	Ya	Ya	Ya	Tidak	Tidak	Ya	Tidak	Ya	Ya	Ya	Ya	Ya	Ya	Tidak	Ya	Tidak	Ya	Tidak
https://www.sewakost.com/jakarta/selatan/kost-putri-33682.html	kost putri	1900000	Kost Putri	Jalan Raya Lenteng Agung, Agung Permai Town House no.27	Ya	Ya	Ya	Ya	Tidak	Tidak	Tidak	Tidak	Ya	Ya	Ya	Ya	Ya	Ya	Tidak	Ya	Tidak	Ya	Ya
https://www.sewakost.com/jakarta/selatan/kost-muslimah-31303.html	Kost muslimah	3400000	Kost Putri	Jl. Antena RT03/08 keldurahan	Tidak	Tidak	Tidak	Tidak	Tidak	Tidak	Tidak	Tidak	Tidak	Tidak	Tidak	Tidak	Tidak	Tidak	Tidak	Tidak	Tidak	Tidak	Tidak
https://www.sewakost.com/jakarta/selatan/kamar-kost-putri-31289.html	Kamar Kost putri	650000	Kost Putri	Jl. H. Jaidi, no. 4a, Rt. 09/11, Pejaten timur pasar minggu	Tidak	Tidak	Tidak	Tidak	Tidak	Tidak	Tidak	Tidak	Tidak	Tidak	Tidak	Tidak	Tidak	Tidak	Tidak	Tidak	Tidak	Tidak	Tidak
https://www.sewakost.com/jakarta/selatan/kos-kosan-khusus-wanita-31260.html	KOS-KOSAN KHUSUS WANITA	450000	Kost Putri	Jalan Persatuan, Cinere	Tidak	Tidak	Tidak	Tidak	Tidak	Tidak	Tidak	Tidak	Tidak	Tidak	Tidak	Tidak	Tidak	Tidak	Tidak	Tidak	Tidak	Tidak	Tidak
https://www.sewakost.com/jakarta/selatan/kost-pakubuwono-31004.html	Kost Pakubuwono	1600000	Kost Campur	Jalan Abdul Rahman 1 NO.8, RW.1, Kebayoran Lama Utara, Kecamatan Kebayoran Lama	Ya	Ya	Ya	Tidak	Tidak	Tidak	Tidak	Tidak	Tidak	Tidak	Tidak	Tidak	Tidak	Tidak	Tidak	Tidak	Tidak	Tidak	Tidak
https://www.sewakost.com/jakarta/selatan/terima-kos-pria-wanita-murah-setiabudi-jak-sel-30960.html	Terima Kos Pria / Wanita  Murah Setiabudi Jak Sel	1500000	Kost Campur	Jl Tiong no 4B karet kuningan Jaksel	Ya	Ya	Ya	Tidak	Tidak	Tidak	Tidak	Tidak	Tidak	Tidak	Tidak	Tidak	Tidak	Tidak	Tidak	Tidak	Tidak	Tidak	Tidak
https://www.sewakost.com/jakarta/selatan/kost-rakha-30895.html	Kost Rakha	1850000	Kost Campur	Jl.lebak bulus 4 H.Niman Rt.07/04 No.31 patokannya dekat Musholla Baiturrahman	Ya	Ya	Ya	Tidak	Tidak	Tidak	Tidak	Tidak	Tidak	Tidak	Tidak	Tidak	Tidak	Tidak	Tidak	Tidak	Tidak	Tidak	Tidak
https://www.sewakost.com/jakarta/selatan/kost-nyaman-dan-aman-di-daerah-mampang-prapatan-jak-sel-30890.html	kost nyaman dan aman di daerah mampang prapatan jak sel	2000000	Kost Putra	mampang prapatan jak sel 12720	Ya	Tidak	Ya	Tidak	Tidak	Tidak	Tidak	Tidak	Tidak	Tidak	Tidak	Tidak	Tidak	Tidak	Tidak	Tidak	Tidak	Tidak	Tidak
https://www.sewakost.com/jakarta/selatan/kost-putri-mangga-paviliun-11-30865.html	Kost Putri Mangga Paviliun 11	2800000	Kost Putri	Jalan Mangga, Paviliun 11, Gandaria Selatan	Ya	Ya	Ya	Tidak	Tidak	Tidak	Tidak	Tidak	Tidak	Tidak	Tidak	Tidak	Tidak	Tidak	Tidak	Tidak	Tidak	Tidak	Tidak
https://www.sewakost.com/jakarta/selatan/rumah-kost-ligna-30051.html	RUMAH KOST LIGNA	3250000	Kost Putri	Jalan Cikatomas No. 3, RT.5/RW.1, Rw. Bar., Kec. Kby. Baru, Kota Jakarta Selatan, Daerah Khusus Ibukota Jakarta 12180	Ya	Ya	Ya	Ya	Tidak	Ya	Ya	Ya	Tidak	Tidak	Ya	Tidak	Tidak	Ya	Tidak	Tidak	Ya	Tidak	Tidak
https://www.sewakost.com/jakarta/selatan/sakura-kost-tebet-30515.html	SAKURA KOST TEBET	2600000	Kost Campur	Jl. D 1 no.4 Kebon Baru ,sebelah Selatan  Komp. Gudang Peluru,Tebet	Ya	Ya	Ya	Tidak	Tidak	Tidak	Tidak	Tidak	Tidak	Tidak	Tidak	Tidak	Tidak	Tidak	Tidak	Tidak	Tidak	Tidak	Tidak
https://www.sewakost.com/jakarta/selatan/kosan-ibu-yani-30186.html	Kosan ibu yani	3000000	Kost Campur	Jalan siaga bappenas	Ya	Ya	Tidak	Tidak	Tidak	Tidak	Tidak	Tidak	Tidak	Tidak	Tidak	Tidak	Tidak	Tidak	Tidak	Tidak	Tidak	Tidak	Tidak
https://www.sewakost.com/jakarta/selatan/kost-hijau-putra-putri-ac-menteng-dalam-dekat-kokas-30138.html	Kost Hijau Putra/Putri ac. Menteng Dalam  Dekat Kokas	1400000	Kost Campur	Gg. Mushola Ar Rahma No. 34 RT 10 RW 15 Mente g Dalam Tebet Jaksel 12870	Ya	Tidak	Ya	Tidak	Tidak	Tidak	Tidak	Tidak	Tidak	Tidak	Tidak	Tidak	Tidak	Tidak	Tidak	Tidak	Tidak	Tidak	Tidak
https://www.sewakost.com/jakarta/selatan/kamar-kost-29893.html	Kamar kost	1750000	Kost Putra	Jl.jaha no 36 RT 012/01 Cilandak timur Jakarta Selatan	Ya	Ya	Ya	Tidak	Tidak	Tidak	Tidak	Tidak	Tidak	Tidak	Tidak	Tidak	Tidak	Tidak	Tidak	Tidak	Tidak	Tidak	Tidak
https://www.sewakost.com/jakarta/selatan/kos-putri-nadia-29853.html	Kos putri nadia	1000000	Kost Putri	Jl.pulo kenanga 5 no 22 RT 07 RW 015 kemandoran 1 Grogol Utara Kebayoran lama Jakarta Selatan 1210	Ya	Tidak	Tidak	Tidak	Tidak	Tidak	Tidak	Tidak	Tidak	Tidak	Tidak	Tidak	Tidak	Tidak	Tidak	Tidak	Tidak	Tidak	Tidak
https://www.sewakost.com/jakarta/selatan/kost-area-lebak-bulus-pondok-pinang-29775.html	Kost Area Lebak Bulus Pondok Pinang	1500000	Kost Putra	Jl. H Saikin RT 011 RW 08 No. 31 A Kelurahan Pondok Pinang Kecamatan Kebayoran Lama ( samping Masjid Al Barkah)	Ya	Ya	Ya	Tidak	Tidak	Tidak	Tidak	Tidak	Tidak	Tidak	Tidak	Tidak	Tidak	Tidak	Tidak	Tidak	Tidak	Tidak	Tidak
https://www.sewakost.com/jakarta/selatan/koolkost-syariah-near-rs-bhayangkara-pondok-pinang-28530.html	KoolKost Syariah near RS. Bhayangkara Pondok Pinang	1700000	Kost Putri	Jl Karyawan No.2 RT1/RW8, Kel Pondok Pinang. Kec. Kebayoran Lama, Jakarta Selatan, Jakarta Selatan, Jakarta, Indonesia	Tidak	Ya	Ya	Tidak	Tidak	Tidak	Tidak	Tidak	Tidak	Tidak	Tidak	Tidak	Tidak	Tidak	Tidak	Tidak	Tidak	Tidak	Tidak
https://www.sewakost.com/jakarta/selatan/indekos-putri-strategis-area-pejaten-village-29722.html	Indekos Putri Strategis Area Pejaten Village	900000	Kost Putri	Damarsari 29 Jatipadang Ps. Minggu Jakarta Selatan (Dekat SMAN 28)	Ya	Tidak	Ya	Tidak	Tidak	Tidak	Tidak	Tidak	Tidak	Tidak	Tidak	Tidak	Tidak	Tidak	Tidak	Tidak	Tidak	Tidak	Tidak
https://www.sewakost.com/jakarta/selatan/oyo-life-2958-kost-lenteng-agung-29717.html	OYO Life 2958 Kost Lenteng Agung	2500000	Kost Campur	40, Jalan Raya Lenteng Agung, Gang Langgar No. 40 RT. 04 / RW. 01, Lenteng Agung, Jagakarsa, Jakarta Selatan, Jakarta	Ya	Ya	Ya	Tidak	Tidak	Tidak	Tidak	Tidak	Tidak	Tidak	Tidak	Tidak	Tidak	Tidak	Tidak	Tidak	Tidak	Tidak	Tidak
https://www.sewakost.com/jakarta/selatan/quot-rdn-quot-kost-khusus-karyawati-jakarta-selatan-29635.html	"""RDN"" Kost Khusus Karyawati, Jakarta Selatan"	1700000	Kost Putri	Jl. Masjid 1 No. 21 Kel. Kebon Baru Kec. Tebet, Jakarta Selatan	Ya	Ya	Ya	Tidak	Tidak	Tidak	Tidak	Tidak	Tidak	Tidak	Tidak	Tidak	Tidak	Tidak	Tidak	Tidak	Tidak	Tidak	Tidak
https://www.sewakost.com/jakarta/selatan/kost-bagus-full-furnish-dalam-cluster-29582.html	Kost Bagus Full Furnish Dalam Cluster	2750000	Kost Pasutri	Rm harsono gg gani	Ya	Ya	Ya	Ya	Ya	Ya	Ya	Ya	Ya	Ya	Ya	Tidak	Tidak	Tidak	Tidak	Ya	Tidak	Tidak	Tidak
https://www.sewakost.com/jakarta/selatan/kost-elite-full-furnish-campur-free-wifi-kencang-ragunan-29312.html	KOST ELITE FULL FURNISH CAMPUR FREE WIFI KENCANG RAGUNAN	2900000	Kost Campur	Jl. RM Harsono	Ya	Ya	Ya	Ya	Ya	Ya	Ya	Ya	Ya	Ya	Ya	Ya	Ya	Ya	Tidak	Ya	Tidak	Tidak	Tidak
https://www.sewakost.com/jakarta/selatan/kost-putra-tanjung-barat-29174.html	Kost putra tanjung barat	450000	Kost Putra	jalan haji Alwi no. 40 rt 4/1, tanjung barat, jakarta selatan	Tidak	Tidak	Tidak	Tidak	Tidak	Tidak	Tidak	Tidak	Tidak	Tidak	Tidak	Tidak	Tidak	Tidak	Tidak	Tidak	Tidak	Tidak	Tidak
https://www.sewakost.com/jakarta/selatan/kos-murah-bebas-banjir-poltangan-tanjung-barat-jakarta-selatan-29102.html	Kos Murah Bebas Banjir Poltangan Tanjung Barat Jakarta Selatan	850000	Kost Putri	Jl. Poltangan Gg. Delima RT 01/05 No. 4, Kec. Jagakarsa, Kel. Tanjung Barat, Jakarta Selatan	Tidak	Tidak	Ya	Tidak	Tidak	Tidak	Tidak	Tidak	Tidak	Ya	Tidak	Tidak	Tidak	Tidak	Tidak	Tidak	Tidak	Tidak	Tidak
https://www.sewakost.com/jakarta/selatan/kost-putri-29060.html	Kost Putri	3000000	Kost Putri	Jl tebef barat XA	Ya	Ya	Ya	Tidak	Tidak	Tidak	Tidak	Tidak	Tidak	Tidak	Tidak	Tidak	Tidak	Tidak	Tidak	Tidak	Tidak	Tidak	Tidak
https://www.sewakost.com/jakarta/selatan/kost-exclusive-murah-tebet-raya-29057.html	Kost Exclusive Murah Tebet Raya	2500000	Kost Campur	Jl Tebet Raya No 98. RT1/RW3. Kel Tebet Timur. Kec Tebet Jakarta Selatan	Ya	Ya	Ya	Tidak	Ya	Tidak	Tidak	Tidak	Tidak	Ya	Tidak	Ya	Ya	Tidak	Tidak	Tidak	Tidak	Tidak	Tidak
https://www.sewakost.com/jakarta/selatan/kost-seulanga-khusus-muslimah-29055.html	Kost Seulanga Khusus Muslimah	550000	Kost Putri	Jl. Pagujaten No. 5 RT.09 RW.07, Pejaten Timur, Kecamatan Pasar Minggu, Jakarta Selatan	Tidak	Ya	Tidak	Tidak	Tidak	Tidak	Tidak	Tidak	Tidak	Tidak	Tidak	Tidak	Tidak	Tidak	Tidak	Tidak	Tidak	Tidak	Tidak
https://www.sewakost.com/jakarta/selatan/istana-kost-tebet-jakarta-selatan-bangunan-baru-29016.html	Istana Kost Tebet Jakarta Selatan Bangunan Baru	1700000	Kost Putra	Sawo Kecik Raya, Gang MHT no 69 & 70, Jl. Ros Timur, RT13/ RW05, Kelurahan Bukit Duri, Kecamatan Tebet, 12820	Ya	Ya	Tidak	Tidak	Tidak	Tidak	Tidak	Tidak	Tidak	Tidak	Tidak	Tidak	Tidak	Tidak	Tidak	Tidak	Tidak	Tidak	Tidak
https://www.sewakost.com/jakarta/selatan/istana-kost-tebet-jakarta-selatan-bangunan-baru-29014.html	Istana Kost Tebet Jakarta Selatan Bangunan Baru	1900000	Kost Putra	Sawo Kecik Raya, Gang MHT no 69 & 70, Jl. Ros Timur, RT13/ RW05, Kelurahan Bukit Duri, Kecamatan Tebet, 12820	Ya	Ya	Ya	Tidak	Tidak	Tidak	Tidak	Tidak	Tidak	Tidak	Tidak	Tidak	Tidak	Tidak	Tidak	Tidak	Tidak	Tidak	Tidak
https://www.sewakost.com/jakarta/selatan/kost-murah-campur-kemang-jakarta-selatan-28975.html	Kost Murah Campur Kemang Jakarta Selatan	3700000	Kost Campur	Jalan Bangka XI No 64. Kel Bangka, Kemang, Jakarta Selatan	Ya	Ya	Ya	Tidak	Ya	Tidak	Tidak	Tidak	Ya	Ya	Tidak	Ya	Ya	Tidak	Tidak	Ya	Tidak	Tidak	Tidak
https://www.sewakost.com/jakarta/selatan/kost-exclusive-dekat-mall-pondok-indah-radio-dalam-10-28891.html	Kost Exclusive dekat Mall Pondok Indah Radio Dalam 10	4800000	Kost Campur	Jl Antene I No 10, RT8/RW12. Gandaria Utara, Kec Kebayoran Baru. Jakarta Selatan	Ya	Ya	Ya	Tidak	Tidak	Tidak	Tidak	Tidak	Tidak	Tidak	Tidak	Tidak	Tidak	Tidak	Tidak	Tidak	Tidak	Tidak	Tidak
https://www.sewakost.com/jakarta/selatan/oyo-life-2590-kost-assirot-28852.html	OYO Life 2590 Kost Assirot	1850000	Kost Campur	Jl. Assirot No.26A RT.5/RW.1, Grogol Sel. Kec. Kby. Lama Kota Jakarta Selatan Daerah Khusus Ibukota Jakarta 12220, Jakarta	Ya	Ya	Ya	Tidak	Tidak	Tidak	Tidak	Tidak	Tidak	Tidak	Tidak	Tidak	Tidak	Tidak	Tidak	Tidak	Tidak	Tidak	Tidak
https://www.sewakost.com/jakarta/selatan/mampang-twenty-residence-28805.html	Mampang Twenty Residence 	2000000	Kost Campur	Jl. Mampang Prapatan II No. 20 Kelurahan Mampang Prapatan 12790 ( Belakang Gedung trans Tv ) Jakarta selatan	Ya	Ya	Ya	Tidak	Tidak	Tidak	Tidak	Tidak	Tidak	Tidak	Tidak	Tidak	Tidak	Tidak	Tidak	Tidak	Tidak	Tidak	Tidak
https://www.sewakost.com/jakarta/selatan/kos-kosan-putra-ibu-umi-28760.html	Kos Kosan Putra Ibu Umi	1300000	Kost Putra	Jl. Cidodol Raya No.22, RT.3/RW.11, Grogol Sel., Kec. Kby. Lama, Kota Jakarta Selatan, Daerah Khusus Ibukota Jakarta 12220	Ya	Ya	Tidak	Tidak	Tidak	Tidak	Tidak	Tidak	Tidak	Tidak	Tidak	Tidak	Tidak	Tidak	Tidak	Tidak	Tidak	Tidak	Tidak
https://www.sewakost.com/jakarta/selatan/kos-manggarai-jakarta-selatan-dekat-stasiun-kereta-api-28709.html	Kos Manggarai - Jakarta Selatan Dekat Stasiun Kereta Api 	1600000	Kost Campur	Jl. Manggarai Utara 1/B No. 18 Pav	Ya	Ya	Tidak	Tidak	Tidak	Tidak	Tidak	Tidak	Tidak	Tidak	Tidak	Tidak	Tidak	Tidak	Tidak	Tidak	Tidak	Tidak	Tidak
https://www.sewakost.com/jakarta/selatan/oyo-life-2351-kost-ciper-28602.html	OYO Life 2351 Kost Ciper 	2300000	Kost Campur	4, Jl. Cipulir Permai P No.4, RT.04/RW.12, Grogol, Kec. Kby. Lama, Kota Jakarta Selatan, Jakarta	Ya	Ya	Ya	Tidak	Tidak	Tidak	Tidak	Tidak	Tidak	Tidak	Tidak	Tidak	Tidak	Tidak	Tidak	Tidak	Tidak	Tidak	Tidak
https://www.sewakost.com/jakarta/selatan/kost-kostan-28482.html	Kost kostan	800000	Kost Putri	Buncit raya pulo kalibata	Tidak	Tidak	Tidak	Tidak	Tidak	Tidak	Tidak	Tidak	Tidak	Tidak	Tidak	Tidak	Tidak	Tidak	Tidak	Tidak	Tidak	Tidak	Tidak
https://www.sewakost.com/jakarta/selatan/kost-28423.html	KOST	1500000	Kost Putra	Jl. Cidodol Kebayoran Lama	Ya	Ya	Tidak	Tidak	Tidak	Tidak	Tidak	Tidak	Tidak	Tidak	Tidak	Tidak	Tidak	Tidak	Tidak	Tidak	Tidak	Tidak	Tidak
https://www.sewakost.com/jakarta/selatan/kost-mahasiswa-prawira-bintaro-28359.html	Kost Mahasiswa Prawira Bintaro	1800000	Kost Putra	Jl.  Taman Bintaro No 1 B Jakarta Selatan	Ya	Ya	Ya	Tidak	Tidak	Tidak	Tidak	Tidak	Tidak	Tidak	Tidak	Tidak	Tidak	Tidak	Tidak	Tidak	Tidak	Tidak	Tidak
https://www.sewakost.com/jakarta/selatan/kosan-ibu-ida-kamar-mandi-dalam-28292.html	Kosan ibu ida  (kamar mandi dalam)	900000	Kost Putra	Alamat lengkap  Jl tanah kusir 2, rt08/rw11/no13 kec. Kebayoran lama,  kel Kebayoran lama selatan,  jakarta selatan	Tidak	Ya	Ya	Tidak	Tidak	Tidak	Tidak	Tidak	Tidak	Tidak	Tidak	Tidak	Tidak	Tidak	Tidak	Tidak	Tidak	Tidak	Tidak
https://www.sewakost.com/jakarta/selatan/kost-exclusive-khusus-wanita-pasutri-28273.html	Kost exclusive khusus wanita / pasutri	1600000	Kost Putri	Jl haji saikin no 22-23 rt 14 rw 08, Pondok Pinang, Kebayoran Lama,	Ya	Ya	Ya	Tidak	Tidak	Tidak	Tidak	Tidak	Tidak	Tidak	Tidak	Tidak	Tidak	Tidak	Tidak	Tidak	Tidak	Tidak	Tidak
https://www.sewakost.com/jakarta/selatan/kost-asri-putri-pancoran-28241.html	Kost asri putri pancoran	1500000	Kost Putri	Jl.cikoko barat 1 gg II no 23 Rt 007 Rw 04 kelurahan cikoko kecamatan Pancoran Jaksel	Ya	Ya	Ya	Tidak	Tidak	Tidak	Tidak	Tidak	Tidak	Tidak	Tidak	Tidak	Tidak	Tidak	Tidak	Tidak	Tidak	Tidak	Tidak
https://www.sewakost.com/jakarta/selatan/rumah-kost-tebet-kamar-bervariatif-amp-lokasi-strategis-28232.html	Rumah Kost Tebet (Kamar Bervariatif & Lokasi Strategis)	1700000	Kost Campur	Jalan Ismail Buntu No. 9 RT 04 RW 06, Bukit Duri, Tebet, Jakarta-Selatan. 12840	Ya	Tidak	Ya	Tidak	Tidak	Tidak	Tidak	Tidak	Tidak	Tidak	Tidak	Tidak	Tidak	Tidak	Tidak	Tidak	Tidak	Tidak	Tidak
https://www.sewakost.com/jakarta/selatan/kost-griya-muslim-28228.html	kost griya muslim	1000000	Kost Putri	jl depsos Gg pertama rt008/rw01 no 32d Bintaro, Pesanggrahan, Jakarta Selatan  12330	Ya	Tidak	Ya	Tidak	Tidak	Tidak	Tidak	Tidak	Tidak	Tidak	Tidak	Tidak	Tidak	Tidak	Tidak	Tidak	Tidak	Tidak	Tidak
https://www.sewakost.com/jakarta/selatan/brand-new-h-studio-tendean-28225.html	Brand New, H Studio @Tendean  	4500000	Kost Campur	Jl. Wijayakarta Raya No. 2A, Kuningan Barat, Mampang Prapatan, Jakarta Selatan	Ya	Ya	Ya	Ya	Ya	Ya	Ya	Tidak	Ya	Ya	Ya	Ya	Tidak	Ya	Ya	Ya	Tidak	Tidak	Tidak
https://www.sewakost.com/jakarta/selatan/kost-muslimah-nabila-28220.html	Kost Muslimah Nabila	800000	Kost Putri	Jl. Camat Gabun No. 39A RT 2 RW 8 Kelurahan Lenteng Agung Kecamatan Jagakarsa Kota Jakarta Selatan	Tidak	Tidak	Ya	Tidak	Tidak	Tidak	Tidak	Tidak	Tidak	Tidak	Tidak	Tidak	Tidak	Tidak	Tidak	Tidak	Tidak	Tidak	Tidak
https://www.sewakost.com/jakarta/selatan/kost-wanita-cemara-seven-status-full-238.html	Kost Wanita Cemara Seven (Status : FULL)	1900000	Kost Putri	Jl. Cemara No. 7, Cipete Selatan	Ya	Ya	Ya	Tidak	Tidak	Tidak	Tidak	Tidak	Tidak	Tidak	Tidak	Tidak	Tidak	Tidak	Tidak	Tidak	Tidak	Tidak	Tidak
https://www.sewakost.com/jakarta/selatan/kost-asri-putri-pancoran-28187.html	Kost asri putri pancoran	1500000	Kost Putri	Jl.cokoko barat I GG II no 23 RT 007 RW 04 Kel.Cikoko Kec. Pancoran Jakarta Selatan	Ya	Ya	Ya	Tidak	Tidak	Tidak	Tidak	Tidak	Tidak	Tidak	Tidak	Tidak	Tidak	Tidak	Tidak	Tidak	Tidak	Tidak	Tidak
