https://www.sewakost.com/jakarta/selatan/kost-47-untuk-pria-amp-wanita-tb-simatupang-jatipadang-pasar-minggu-53890.html	Kost 47 Untuk Pria & Wanita (TB.Simatupang Jatipadang, Pasar Minggu)	1000000	Kost Campur	Jalan TB.Simatupang Jatipadang Gang Salihan RT05/04 No.47 Pasar Minggu, Jakarta Selatan	Tidak	Tidak	Ya	Tidak	Tidak	Tidak	Tidak	Tidak	Ya	Ya	Tidak	Tidak	Ya	Tidak	Tidak	Tidak	Tidak	Tidak	Tidak
https://www.sewakost.com/jakarta/selatan/kos-kosan-di-daerah-straegic-dan-murah-53871.html	Kos Kosan di daerah straegic dan murah	2300000	Kost Campur	jl Tiong no 4B	Ya	Ya	Ya	Ya	Tidak	Ya	Ya	Tidak	Tidak	Ya	Ya	Tidak	Ya	Tidak	Ya	Ya	Ya	Tidak	Tidak
https://www.sewakost.com/jakarta/selatan/rezkalla-kost-khusus-putri-53849.html	Rezkalla Kost Khusus Putri	1600000	Kost Putri	Jl H Sa'aba no 47c Kemang cipete	Ya	Ya	Ya	Ya	Tidak	Tidak	Tidak	Ya	Ya	Ya	Ya	Tidak	Ya	Ya	Tidak	Ya	Tidak	Tidak	Tidak
https://www.sewakost.com/jakarta/selatan/terima-kost-pria-wanita-bisa-berdua-free-wifi-air-listrik-53819.html	Terima Kost Pria/Wanita Bisa berdua Free Wifi Air Listrik	1600000	Kost Campur	Jalan pulo cempaka 4 no.11 rt006/rw016 Kelurahan Grogol Utara Kecamatan Kebayoran Lama Jakarta Selatan	Ya	Ya	Tidak	Ya	Ya	Ya	Tidak	Ya	Ya	Ya	Ya	Tidak	Ya	Tidak	Ya	Tidak	Tidak	Ya	Tidak
https://www.sewakost.com/jakarta/selatan/rari-kost-34984.html	Rari Kost	1950000	Kost Putri	jalan nimun raya no 20.i rt12 rw 10 tanah kusir	Ya	Ya	Ya	Ya	Ya	Tidak	Tidak	Ya	Ya	Ya	Ya	Ya	Ya	Ya	Tidak	Ya	Tidak	Ya	Ya
https://www.sewakost.com/jakarta/selatan/kost-eksklusif-lapangan-ros-tebet-48792.html	Kost Eksklusif Lapangan Ros Tebet	1300000	Kost Campur	jl. Lapangan Ros 3 no. 34 Bukit Duri, Tebet, Jakarta Selatan	Ya	Ya	Ya	Ya	Ya	Tidak	Tidak	Tidak	Ya	Ya	Ya	Tidak	Tidak	Tidak	Tidak	Tidak	Ya	Tidak	Tidak
https://www.sewakost.com/jakarta/selatan/kost-campur-lengkap-furniture-kamar-mandi-luar-53694.html	Kost campur lengkap furniture kamar mandi luar	750000	Kost Campur	Jl. Agung raya I-39D lenteng agung jakarta selatan	Tidak	Ya	Tidak	Ya	Ya	Tidak	Tidak	Tidak	Ya	Ya	Ya	Ya	Ya	Ya	Ya	Ya	Tidak	Ya	Ya
https://www.sewakost.com/jakarta/selatan/disewakan-kost-lengkap-ac-furniture-kamarmandi-dalam-35011.html	Disewakan kost lengkap AC furniture  kamarmandi dalam	1600000	Kost Campur	Jl. Agung raya I-39Dlenteng agung jagakarsa jakarta selatan selatan	Ya	Ya	Ya	Ya	Ya	Tidak	Tidak	Ya	Ya	Ya	Ya	Ya	Ya	Ya	Ya	Ya	Ya	Tidak	Ya
https://www.sewakost.com/jakarta/selatan/kost-murah-di-fatmawati-53496.html	Kost murah di fatmawati	1500000	Kost Campur	Jl.H.Niman No23b. Cilandak barat Jak,Sel	Ya	Ya	Ya	Ya	Ya	Tidak	Tidak	Tidak	Ya	Ya	Tidak	Tidak	Ya	Tidak	Tidak	Ya	Tidak	Tidak	Tidak
https://www.sewakost.com/jakarta/selatan/kost-exclusive-tebet-53447.html	Kost Exclusive Tebet	3500000	Kost Campur	Jl. Manggis I No.4, RT.11/RW.4, Manggarai Sel., Jakarta, Kota Jakarta Selatan, Daerah Khusus Ibukota Jakarta 12860	Ya	Ya	Ya	Tidak	Ya	Tidak	Ya	Tidak	Ya	Ya	Tidak	Tidak	Ya	Ya	Tidak	Ya	Tidak	Tidak	Tidak
https://www.sewakost.com/jakarta/selatan/epicentrum-kost-termurah-53154.html	Epicentrum Kost Termurah	850000	Kost Putri	Jl. Menteng Atas Selatan gang 8 no 12	Tidak	Tidak	Tidak	Tidak	Tidak	Tidak	Tidak	Tidak	Tidak	Tidak	Tidak	Tidak	Ya	Tidak	Tidak	Tidak	Tidak	Tidak	Tidak
https://www.sewakost.com/jakarta/selatan/dd-kos-tb-simatupang-blkg-gedung-antam-new-16887.html	DD Kos TB Simatupang, blkg Gedung Antam, NEW!	2000000	Kost Campur	TB Simatupang, belakang Gedung Antam	Ya	Ya	Ya	Ya	Ya	Ya	Ya	Tidak	Ya	Ya	Ya	Ya	Ya	Tidak	Ya	Ya	Ya	Ya	Ya
https://www.sewakost.com/jakarta/selatan/kost-karyawan-pria-radio-dalam-jakarta-selatan-53070.html	Kost Karyawan (Pria) Radio Dalam  Jakarta Selatan	815000	Kost Putra	Jalan HKSN 88 No.12, Kebayoran Lama, Jakarta Selatan	Tidak	Tidak	Ya	Ya	Ya	Tidak	Tidak	Tidak	Tidak	Ya	Ya	Tidak	Ya	Tidak	Tidak	Tidak	Tidak	Tidak	Tidak
https://www.sewakost.com/jakarta/selatan/kost-karyawan-pria-fatmawati-jakarta-selatan-53068.html	Kost Karyawan (Pria) Fatmawati Jakarta Selatan	1700000	Kost Putra	Jalan Wahyu III No 18, Gandaria Selatan, Cilandak, Jakarta Selatan	Ya	Ya	Ya	Ya	Ya	Tidak	Ya	Tidak	Tidak	Ya	Ya	Tidak	Ya	Ya	Tidak	Tidak	Tidak	Tidak	Tidak
https://www.sewakost.com/jakarta/selatan/kost-karyawan-tebet-kebon-baru-jakarta-selatan-53067.html	Kost Karyawan Tebet Kebon Baru Jakarta Selatan	1700000	Kost Putra	Jalan D4 No 16, Kebon Baru, Tebet, Jakarta Selatan (Komplek Gudang Peluru)	Ya	Ya	Ya	Ya	Ya	Tidak	Ya	Tidak	Tidak	Ya	Ya	Ya	Ya	Ya	Tidak	Ya	Tidak	Ya	Ya
https://www.sewakost.com/jakarta/selatan/kost-eksklusif-logo-residence-52707.html	KOST EKSKLUSIF LOGO RESIDENCE	3000000	Kost Campur	Jl. H. Logo No. 24 RT. 002/15 Gandaria Utara, Kebayoran Baru, Jakarta Selatan	Ya	Ya	Ya	Ya	Ya	Ya	Tidak	Ya	Ya	Ya	Ya	Ya	Tidak	Ya	Ya	Tidak	Tidak	Tidak	Ya
https://www.sewakost.com/jakarta/selatan/kost-putri-53010.html	Kost putri	1500000	Kost Putri	Jl.vikoko barat 1 no 27 vikoko pancoran jakarta selatan	Ya	Ya	Ya	Ya	Ya	Tidak	Tidak	Ya	Tidak	Ya	Tidak	Tidak	Ya	Ya	Tidak	Tidak	Ya	Tidak	Tidak
https://www.sewakost.com/jakarta/selatan/kost-wanita-sekitar-kuningan-setia-budi-sudirman-6077.html	Kost wanita sekitar kuningan, setia budi, sudirman	1300000	Kost Putri	Jln Salak kel Guntur kec Setia budi jakarta selatan., Jakarta	Ya	Ya	Ya	Ya	Tidak	Tidak	Tidak	Tidak	Ya	Ya	Tidak	Ya	Ya	Tidak	Tidak	Tidak	Tidak	Tidak	Tidak
https://www.sewakost.com/jakarta/selatan/kost-jakarta-selatan-senopati-tendean-scbd-52889.html	KOST JAKARTA SELATAN SENOPATI TENDEAN SCBD	1000000	Kost Campur	Jl. Pecandran bawah no. 11a Kebayoran baru Jaksel	Ya	Ya	Ya	Ya	Tidak	Tidak	Tidak	Tidak	Tidak	Ya	Tidak	Tidak	Tidak	Tidak	Tidak	Tidak	Tidak	Tidak	Tidak
https://www.sewakost.com/jakarta/selatan/kos-murah-jakarta-selatan-senopati-scbd-tendean-52892.html	Kos Murah Jakarta Selatan Senopati SCBD Tendean	1000000	Kost Campur	Jalan kebalen 2 bawah no. 18	Ya	Ya	Ya	Ya	Tidak	Tidak	Tidak	Tidak	Ya	Ya	Tidak	Tidak	Tidak	Tidak	Tidak	Tidak	Tidak	Tidak	Tidak
https://www.sewakost.com/jakarta/selatan/kos-kosan-murah-daerah-kemang-mampang-blok-m-52888.html	Kos kosan murah daerah kemang mampang blok m 	900000	Kost Campur	Marzuqos Gg.H.marzuqi jl.bangka II G no.12A rt 3/3 pela mampang mampang prapatan jakarta selatan	Tidak	Ya	Ya	Ya	Tidak	Tidak	Tidak	Tidak	Tidak	Ya	Ya	Tidak	Ya	Tidak	Tidak	Tidak	Tidak	Tidak	Ya
https://www.sewakost.com/jakarta/selatan/kost-jakarta-selatan-tebet-puri-mandala-52882.html	Kost  Jakarta Selatan, Tebet, Puri Mandala	1800000	Kost Campur	Jl.Jaya Mandala 1 No.49 Menteng Dalam,Tebet,Jakarta Selatan	Ya	Ya	Ya	Ya	Ya	Ya	Tidak	Tidak	Ya	Ya	Ya	Tidak	Ya	Ya	Ya	Tidak	Tidak	Tidak	Tidak
https://www.sewakost.com/jakarta/selatan/kost-putri-fika-amp-sani-52759.html	KOST PUTRI FIKA & SANI	550000	Kost Putri	jl ulu jami raya pesangGrahan H buang gg saumin rt2 rw07 jakarta selatan	Tidak	Tidak	Tidak	Ya	Ya	Tidak	Tidak	Tidak	Tidak	Ya	Tidak	Tidak	Ya	Tidak	Tidak	Tidak	Tidak	Tidak	Tidak
https://www.sewakost.com/jakarta/selatan/my-kost-cipete-52746.html	My Kost.Cipete	1500000	Kost Campur	Jalan Cipete Raya (Gang Haji Satra) no.20B RT 10 Rw 06, Cipete Selatan, Cilandak, Jakarta Selatan	Ya	Ya	Ya	Tidak	Tidak	Tidak	Tidak	Tidak	Tidak	Ya	Tidak	Tidak	Ya	Tidak	Tidak	Tidak	Tidak	Tidak	Tidak
https://www.sewakost.com/jakarta/selatan/kos-barokah-nyaman-52699.html	Kos barokah nyaman	2000000	Kost Campur	Jln S no 22 rt 04 rw 11 kebon baru. Kecamatan tebet.jakarta selatan	Ya	Ya	Ya	Ya	Tidak	Ya	Tidak	Tidak	Ya	Tidak	Ya	Tidak	Ya	Ya	Tidak	Ya	Tidak	Ya	Tidak
https://www.sewakost.com/jakarta/selatan/kosan-baru-khusus-putri-52653.html	Kosan Baru Khusus Putri	1200000	Kost Putri	Jl Sawo No 42 Kelurahan Karet Kuningan Jakarta 12940	Tidak	Tidak	Ya	Ya	Ya	Tidak	Tidak	Tidak	Tidak	Tidak	Ya	Tidak	Tidak	Tidak	Tidak	Tidak	Tidak	Tidak	Tidak
https://www.sewakost.com/jakarta/selatan/kos-jalan-wahyu-22-52631.html	Kos Jalan Wahyu 22	2500000	Kost Campur	Jl Wahyu Raya no.22, Gandaria Selatan	Ya	Ya	Ya	Ya	Ya	Ya	Tidak	Tidak	Tidak	Ya	Tidak	Ya	Ya	Tidak	Tidak	Tidak	Tidak	Tidak	Tidak
https://www.sewakost.com/jakarta/selatan/rumah-kost-rey-1-29443.html	Rumah kost Rey 1	950000	Kost Campur	Jln. Masjid VII No. 68 Rt 006/06 Kebayoran Baru Jakarta Selatan	Tidak	Tidak	Ya	Tidak	Tidak	Tidak	Tidak	Tidak	Tidak	Tidak	Tidak	Tidak	Tidak	Tidak	Tidak	Tidak	Tidak	Tidak	Tidak
https://www.sewakost.com/jakarta/selatan/rumah-kost-rey-2-52597.html	Rumah Kost Rey 2	950000	Kost Campur	Jln. Masjid 7 no.25 kel. gandaria Utara kec. kebayoran baru jakarta selatan	Ya	Tidak	Ya	Tidak	Tidak	Tidak	Tidak	Tidak	Tidak	Ya	Tidak	Tidak	Ya	Tidak	Tidak	Tidak	Tidak	Tidak	Tidak
https://www.sewakost.com/jakarta/selatan/kost-dng-home-duren-tiga-jakarta-selatan-52556.html	Kost DnG Home -Duren Tiga Jakarta Selatan-	2500000	Kost Campur	Jl. Duren Tiga Barat No. 22A	Ya	Ya	Ya	Ya	Ya	Ya	Tidak	Tidak	Ya	Ya	Ya	Tidak	Ya	Tidak	Tidak	Ya	Tidak	Tidak	Tidak
https://www.sewakost.com/jakarta/selatan/homikos-kos-eksklusif-ragunan-52528.html	Homikos, kos eksklusif Ragunan	2500000	Kost Campur	jl.Poncol no.115,, RT 03/RW 05, PasarMinggu, Jakarta Selatan 12550	Ya	Ya	Ya	Ya	Ya	Ya	Ya	Tidak	Ya	Ya	Ya	Ya	Ya	Ya	Ya	Tidak	Ya	Ya	Ya
https://www.sewakost.com/jakarta/selatan/sewa-kost-52531.html	Sewa Kost	1900000	Kost Campur	Persada Raya	Ya	Ya	Ya	Ya	Ya	Tidak	Tidak	Tidak	Ya	Ya	Tidak	Tidak	Tidak	Ya	Tidak	Tidak	Tidak	Tidak	Tidak
https://www.sewakost.com/jakarta/selatan/kos-sri-suciati-bintaro-rempoa-fasilitas-wifi-52516.html	KOS SRI SUCIATI BINTARO REMPOA FASILITAS WIFI	1100000	Kost Putri	JLN. PERDAGANGAN 1 RT 002 RW 007 KELURAHAN BINTARO KECAMATAN PESANGGRAHAN NO 6A JAKARTA SELATAN	Tidak	Ya	Ya	Ya	Tidak	Tidak	Tidak	Tidak	Tidak	Ya	Tidak	Tidak	Tidak	Tidak	Tidak	Tidak	Tidak	Tidak	Tidak
https://www.sewakost.com/jakarta/selatan/kos-kosan-sri-suciati-kmr-mnd-dalam-52408.html	Kos kosan sri suciati kmr mnd dalam	1100000	Kost Putri	JLN. PERDAGANGAN 1 RT 002 RW 007 KELURAHAN BINTARO KECAMATAN PESANGGRAHAN NO 6A JAKARTA SELATAN	Tidak	Ya	Ya	Tidak	Tidak	Tidak	Tidak	Tidak	Tidak	Ya	Tidak	Tidak	Tidak	Tidak	Tidak	Tidak	Tidak	Tidak	Tidak
https://www.sewakost.com/jakarta/selatan/kosan-jagakarsa-aman-nyaman-dan-tenang-52175.html	Kosan Jagakarsa aman, nyaman dan tenang 	1400000	Kost Campur	Belimbing village jl belimbing no 32 jagakarsa jakarta selatan 12620	Ya	Ya	Ya	Ya	Ya	Tidak	Tidak	Ya	Tidak	Ya	Ya	Tidak	Ya	Tidak	Tidak	Tidak	Tidak	Tidak	Ya
https://www.sewakost.com/jakarta/selatan/gondrong-kost-52163.html	Gondrong Kost	1100000	Kost Putri	Jln. KH Abdullah Syafe'ie no.14 Tebet Timur	Ya	Tidak	Ya	Ya	Tidak	Tidak	Tidak	Tidak	Tidak	Tidak	Tidak	Tidak	Tidak	Tidak	Tidak	Tidak	Tidak	Tidak	Tidak
https://www.sewakost.com/jakarta/selatan/kost-full-furnish-mampang-prapatan-pancoran-tendean-kemang-blok-m-kuningan-50030.html	Kost full furnish Mampang Prapatan Pancoran Tendean Kemang Blok M Kuningan	1950000	Kost Campur	Mampang Prapatan 7 Komplek Pondok Jaya IX No. 22B	Ya	Ya	Ya	Ya	Ya	Tidak	Tidak	Tidak	Ya	Ya	Ya	Tidak	Ya	Tidak	Tidak	Ya	Tidak	Tidak	Tidak
https://www.sewakost.com/jakarta/selatan/kos-kosan-murah-strategis-di-wilayah-selatan-jakarta-dekat-stasiun-mrt-50023.html	Kos-kosan Murah Strategis di wilayah Selatan Jakarta Dekat Stasiun MRT	850000	Kost Campur	Jl pertanian Raya No.41 Rt.004/004 Lebak Bulus Cilandak Jakarta Selatan	Tidak	Tidak	Ya	Ya	Ya	Tidak	Tidak	Tidak	Ya	Ya	Tidak	Tidak	Tidak	Tidak	Tidak	Tidak	Tidak	Tidak	Tidak
https://www.sewakost.com/jakarta/selatan/kosan-penam-50005.html	KOSAN PENAM	1700000	Kost Campur	SEBERANG SMAN 28 JAKARTA JALAN RAYA RAGUNAN NO. P-6 KOST DI AREA PASAR MINGGU	Ya	Ya	Ya	Ya	Tidak	Ya	Ya	Tidak	Ya	Ya	Tidak	Tidak	Ya	Tidak	Tidak	Ya	Tidak	Tidak	Tidak
https://www.sewakost.com/jakarta/selatan/kos-exclusive-setiabudi-49976.html	KOS EXCLUSIVE SETIABUDI	3000000	Kost Campur	Jl. Kencana 30, Pasar Manggis, Setia Budi, Jakarta Selatan	Ya	Ya	Ya	Ya	Ya	Ya	Ya	Ya	Ya	Ya	Ya	Ya	Ya	Tidak	Tidak	Ya	Tidak	Ya	Tidak
https://www.sewakost.com/jakarta/selatan/terima-kost-wanita-di-setiabudi-barat-49874.html	Terima Kost Wanita di Setiabudi Barat	2000000	Kost Putri	Jl. Setiabudi Barat No. 26, RT 02 / RW 02, Jakarta Selatan 12910	Ya	Ya	Tidak	Tidak	Tidak	Tidak	Tidak	Tidak	Tidak	Tidak	Tidak	Tidak	Tidak	Tidak	Tidak	Tidak	Tidak	Tidak	Tidak
https://www.sewakost.com/jakarta/selatan/kos-kekinian-khusus-wanita-dekat-kokas-kuningan-tebet-setiabudi-49830.html	Kos Kekinian Khusus Wanita Dekat Kokas, Kuningan, Tebet, Setiabudi	2200000	Kost Putri	Jl.Lontar no.11 RT.09 RW.14, Menteng Atas, Setia Budi, Jakarta Selatan	Ya	Ya	Ya	Ya	Tidak	Ya	Ya	Tidak	Ya	Ya	Ya	Tidak	Ya	Ya	Tidak	Ya	Tidak	Tidak	Ya
https://www.sewakost.com/jakarta/selatan/kost-putri-karyawati-jl-bacang-3-49820.html	Kost Putri / Karyawati Jl. Bacang 3	800000	Kost Putri	Jl. Bacang 3 No. 14, RT.06/RT.01, Kel. Kramat Pela, Kec. Kebayoran Baru, Jakarta Selatan, 12130	Tidak	Ya	Tidak	Ya	Ya	Tidak	Ya	Tidak	Ya	Ya	Ya	Ya	Tidak	Tidak	Tidak	Tidak	Tidak	Tidak	Ya
https://www.sewakost.com/jakarta/selatan/kost-dekat-tebet-62-857-6552-8597-49809.html	Kost dekat tebet +62 857-6552-8597	1700000	Kost Campur	Jl. Mutumanikam No 9 Cawang Atas	Ya	Ya	Ya	Ya	Tidak	Tidak	Tidak	Tidak	Tidak	Tidak	Tidak	Tidak	Tidak	Tidak	Tidak	Tidak	Tidak	Tidak	Tidak
https://www.sewakost.com/jakarta/selatan/rumah-kost-warna-warni-cilandak-49778.html	Rumah Kost Warna Warni (Cilandak) 	1600000	Kost Putri	Jl. Cilandak Bawah III No. 1A, Cilandak Barat, Cilandak, Jakarta Selatan	Ya	Ya	Ya	Ya	Ya	Tidak	Tidak	Ya	Tidak	Ya	Ya	Tidak	Ya	Ya	Tidak	Tidak	Tidak	Tidak	Tidak
https://www.sewakost.com/jakarta/selatan/oma-kost-rumah-kost-strategis-kamar-ac-full-furnished-harga-bersahabat-49720.html	Oma Kost ,Rumah Kost strategis,kamar ac,full furnished ,harga bersahabat	1100000	Kost Campur	Jl.karet gg.tiong no.29B RT 009/RW 006,kel.karet kuningan,kec. Setia budi, jakarta selatan	Ya	Tidak	Tidak	Ya	Ya	Tidak	Tidak	Tidak	Tidak	Ya	Ya	Tidak	Tidak	Tidak	Tidak	Tidak	Tidak	Tidak	Tidak
https://www.sewakost.com/jakarta/selatan/kost-haji-abror-ida-pasarminggu-49706.html	Kost Haji Abror/Ida Pasarminggu	1800000	Kost Campur	Jalan Asem No. 4 (Gang Sosial) rt 11/001 Pasarminggu Jakarta Selatan 12520	Ya	Tidak	Ya	Ya	Tidak	Tidak	Tidak	Tidak	Ya	Ya	Tidak	Tidak	Tidak	Tidak	Tidak	Tidak	Tidak	Tidak	Tidak
https://www.sewakost.com/jakarta/selatan/kost-putra-pagarmas-radio-dalam-49682.html	Kost Putra PagarMas Radio Dalam	1700000	Kost Putra	Jl. Salim radio dalam gandaria utara jakarta selatan ( samping nya SPBU Shell)	Ya	Ya	Ya	Ya	Tidak	Tidak	Ya	Tidak	Ya	Ya	Ya	Tidak	Tidak	Ya	Tidak	Tidak	Tidak	Tidak	Ya
https://www.sewakost.com/jakarta/selatan/kost-safa-aldina-jati-padang-49661.html	Kost Safa Aldina Jati Padang	800000	Kost Putri	Jl Jati Padang Gg Menara RT004/04	Tidak	Tidak	Ya	Ya	Tidak	Tidak	Tidak	Tidak	Tidak	Ya	Tidak	Tidak	Tidak	Tidak	Tidak	Tidak	Tidak	Tidak	Tidak
https://www.sewakost.com/jakarta/selatan/kost-iwan-rawajati-kalibata-49647.html	Kost Iwan Rawajati Kalibata	1000000	Kost Campur	Jalan Rawajati Timur VIII No 5B Rt 004 Rw 008 Kel Rawajati Kec Pancoran Jakarta DKI Jakarta 12750 Indonesia	Tidak	Tidak	Ya	Tidak	Tidak	Tidak	Tidak	Tidak	Tidak	Tidak	Tidak	Tidak	Tidak	Tidak	Tidak	Tidak	Tidak	Tidak	Tidak
https://www.sewakost.com/jakarta/selatan/kos-murah-daerah-kuningan-kasablanka-menteng-49629.html	Kos murah daerah kuningan, kasablanka, menteng	1600000	Kost Campur	Jl. Menteng Atas Barat Gg. 4. Setia budi, Jakarta Selatan	Ya	Ya	Ya	Ya	Tidak	Tidak	Tidak	Tidak	Tidak	Ya	Ya	Tidak	Ya	Ya	Tidak	Tidak	Ya	Ya	Ya
https://www.sewakost.com/jakarta/selatan/kost-muslimah-49620.html	KOST MUSLIMAH	1350000	Kost Putri	Jl.Bambu Kuning Buntu no 8 Pejaten Jakarta Selatan	Ya	Ya	Tidak	Ya	Ya	Tidak	Tidak	Ya	Tidak	Ya	Ya	Tidak	Ya	Tidak	Tidak	Ya	Tidak	Tidak	Ya
https://www.sewakost.com/jakarta/selatan/homey-house-kos-wanita-di-karet-kuningan-setiabudi-jakarta-selatan-49576.html	Homey house Kos wanita di karet kuningan setiabudi jakarta selatan	1500000	Kost Putri	karet, setiabudi, jakarta selatan	Ya	Ya	Tidak	Ya	Ya	Tidak	Tidak	Tidak	Tidak	Ya	Ya	Ya	Ya	Ya	Tidak	Tidak	Ya	Ya	Tidak
https://www.sewakost.com/jakarta/selatan/kost-di-halimun-setiabudi-kost-nyaman-dan-strategis-kamar-luas-49530.html	Kost di Halimun, Setiabudi, kost nyaman dan strategis, kamar luas	4500000	Kost Campur	Jl. Slamet , Setiabudi, Jakarta Selatan	Ya	Ya	Ya	Ya	Tidak	Tidak	Ya	Tidak	Ya	Tidak	Ya	Ya	Ya	Tidak	Ya	Ya	Tidak	Tidak	Tidak
https://www.sewakost.com/jakarta/selatan/kost-pria-di-tebet-barat-49483.html	Kost Pria di Tebet Barat	1500000	Kost Putra	Jl. Tebet Barat VII A No. 2  Jakarta Selatan	Ya	Ya	Ya	Ya	Tidak	Tidak	Tidak	Tidak	Tidak	Ya	Tidak	Tidak	Tidak	Tidak	Tidak	Tidak	Tidak	Tidak	Tidak
https://www.sewakost.com/jakarta/selatan/almuntaha-exclusive-mampang-kemang-jaksel-21467.html	Almuntaha Exclusive Mampang, Kemang, Jaksel	3500000	Kost Campur	Jln. Pondok Jaya IV No.14 Rt.04/Rw.06, Pela Mampang, Mampang Prapatan Jakarta Selatan 12720	Ya	Ya	Ya	Ya	Ya	Ya	Ya	Ya	Ya	Ya	Ya	Ya	Ya	Ya	Ya	Ya	Ya	Ya	Ya
https://www.sewakost.com/jakarta/selatan/kost-putri-fika-49402.html	KOST PUTRI FIKA	550000	Kost Putri	jl ulu jami raya pesangrahan h buang gg saumin rt2 rw07 jakarta selatan	Tidak	Tidak	Tidak	Ya	Ya	Tidak	Tidak	Tidak	Tidak	Tidak	Tidak	Tidak	Ya	Tidak	Tidak	Tidak	Tidak	Tidak	Tidak
https://www.sewakost.com/jakarta/selatan/kost-putri-murah-23605.html	KOST PUTRI MURAH	400000	Kost Putri	Gg tabah rt 09/03 no 169 ulujami kecamatan pesanggrahan jakarta selatan (deket itc cipulir)	Tidak	Tidak	Tidak	Tidak	Tidak	Tidak	Tidak	Tidak	Tidak	Tidak	Tidak	Tidak	Tidak	Tidak	Tidak	Tidak	Tidak	Tidak	Tidak
https://www.sewakost.com/jakarta/selatan/kos-putri-di-stasiun-fatmawati-mrt-49319.html	Kos Putri di Stasiun Fatmawati MRT	1100000	Kost Putri	Jl. Banjarsari 8 No. 18, Cilandak Barat, Cilandak, Jakarta Selatan	Tidak	Ya	Tidak	Tidak	Tidak	Tidak	Tidak	Tidak	Tidak	Ya	Tidak	Tidak	Ya	Ya	Tidak	Tidak	Tidak	Tidak	Tidak
https://www.sewakost.com/jakarta/selatan/kost-putra-49069.html	KOST PUTRA	1350000	Kost Putra	jalan menteng wadas utara rt 010 rw 006 no 3	Ya	Ya	Tidak	Ya	Ya	Tidak	Tidak	Tidak	Tidak	Ya	Tidak	Tidak	Ya	Tidak	Tidak	Tidak	Ya	Tidak	Tidak
https://www.sewakost.com/jakarta/selatan/disewakan-kos-kosan-exclusive-bangunan-baru-di-daerah-tebet-dekat-daerah-perkantoran-49025.html	Disewakan kos-kosan exclusive bangunan baru di daerah Tebet. Dekat daerah perkantoran	2100000	Kost Campur	Jl. Asem baris, Kebon Baru. Tebet. Jakarta Selatan	Ya	Ya	Ya	Ya	Ya	Ya	Tidak	Ya	Ya	Ya	Ya	Ya	Ya	Ya	Ya	Tidak	Tidak	Tidak	Tidak
https://www.sewakost.com/jakarta/selatan/sewa-kost-di-kebayoran-lama-jakarta-selatan-gs-kost-49021.html	Sewa kost di Kebayoran Lama Jakarta Selatan (GS KOST)	950000	Kost Campur	Jl. AA no. 12 rt.11/rw.4 samping mushola Al Amin dan samping TIKI, Pos Pengumben. Kebayoran lama. Jakarta	Ya	Ya	Tidak	Tidak	Tidak	Tidak	Tidak	Tidak	Tidak	Tidak	Tidak	Tidak	Tidak	Tidak	Tidak	Tidak	Tidak	Tidak	Tidak
https://www.sewakost.com/jakarta/selatan/kostigadua-mampang-prapatan-48956.html	Kostigadua Mampang Prapatan	1900000	Kost Campur	Jalan Mampang Prapatan IV No.32	Ya	Ya	Ya	Ya	Ya	Tidak	Tidak	Ya	Tidak	Ya	Tidak	Tidak	Tidak	Ya	Ya	Tidak	Tidak	Tidak	Tidak
https://www.sewakost.com/jakarta/selatan/kost-gardenia-pasar-minggu-jakarta-selatan-48917.html	Kost Gardenia Pasar Minggu Jakarta Selatan	1500000	Kost Campur	jl. hortikultura no. 35, pasar minggu, jakarta selatan	Ya	Ya	Ya	Tidak	Tidak	Tidak	Ya	Tidak	Tidak	Ya	Tidak	Tidak	Tidak	Ya	Tidak	Ya	Tidak	Ya	Tidak
https://www.sewakost.com/jakarta/selatan/kos-pelita-48886.html	Kos Pelita 	5000000	Kost Campur	jalan bunga kenanga no. 24, abdul majid, cipete selatan	Ya	Ya	Ya	Tidak	Tidak	Tidak	Ya	Tidak	Tidak	Ya	Tidak	Ya	Ya	Ya	Tidak	Ya	Tidak	Ya	Ya
https://www.sewakost.com/jakarta/selatan/kost-exclusive-tb-simatupang-urbanest-inn-house-48861.html	Kost Exclusive TB Simatupang - Urbanest Inn House	3500000	Kost Campur	Jl. Villa Jatipadang No. 52, RT 3/ RW 8, Jatipadang, Kec. Ps. Minggu, Jakarta Selatan, 12540	Ya	Ya	Ya	Ya	Ya	Ya	Ya	Ya	Ya	Ya	Ya	Ya	Ya	Ya	Ya	Ya	Ya	Ya	Tidak
https://www.sewakost.com/jakarta/selatan/kost-exclusive-setiabudi-sunrise-house-48860.html	Kost Exclusive Setiabudi - Sunrise House	3500000	Kost Campur	Jl. Setiabudi VI No.45, RT.3/RW.3, Kuningan, Setia Budi, South Jakarta City, Jakarta 12910	Ya	Ya	Ya	Ya	Ya	Tidak	Ya	Ya	Ya	Ya	Tidak	Ya	Ya	Ya	Ya	Tidak	Ya	Tidak	Tidak
https://www.sewakost.com/jakarta/selatan/kost-selatan-nyaman-48857.html	Kost Selatan Nyaman	2100000	Kost Campur	JL.Cileduk Raya no.11A , Kelurahan Ulujami, Kecamatan Pesangrahan Jakarta Selatan. (100 meter dari ITC Cipulir).	Ya	Ya	Ya	Ya	Tidak	Tidak	Tidak	Tidak	Tidak	Tidak	Ya	Ya	Ya	Ya	Tidak	Ya	Tidak	Ya	Tidak
https://www.sewakost.com/jakarta/selatan/kost-rumah-kebun-48793.html	Kost Rumah kebun	2100000	Kost Campur	Cipulir Raya (samping Kampus BSI) Sebrang kantor Pajak Kebayoran Lama.	Ya	Ya	Ya	Ya	Tidak	Tidak	Tidak	Tidak	Tidak	Ya	Ya	Ya	Ya	Ya	Tidak	Ya	Tidak	Ya	Tidak
https://www.sewakost.com/jakarta/selatan/kosan-murah-di-jakarta-selatan-free-wifi-48747.html	Kosan Murah di Jakarta Selatan Free WiFi	1000000	Kost Campur	Jalan Kebagusan Raya Gg asem RT 09 RW 07 No 8 Kebagusan Pasar Minggu Jakarta Selatan DKI Jakarta	Tidak	Ya	Ya	Tidak	Tidak	Tidak	Tidak	Tidak	Ya	Ya	Tidak	Tidak	Ya	Tidak	Tidak	Tidak	Tidak	Tidak	Tidak
https://www.sewakost.com/jakarta/selatan/terima-kost-dekat-perkantoran-sudirman-dan-kuningan-48711.html	Terima kost dekat perkantoran sudirman dan kuningan	1700000	Kost Campur	Jl. Setiabudi Jakarta Selatan	Ya	Ya	Ya	Ya	Ya	Tidak	Tidak	Tidak	Tidak	Ya	Tidak	Tidak	Tidak	Tidak	Tidak	Tidak	Ya	Tidak	Tidak
https://www.sewakost.com/jakarta/selatan/sewakost-murah-di-jakarta-selatan-48688.html	SEWAKOST MURAH DI JAKARTA SELATAN 	1600000	Kost Campur	Jalan. Kemandoran VII No. 3 ( Gang sebelah dealer Daihatsu )	Tidak	Ya	Ya	Ya	Ya	Tidak	Tidak	Ya	Tidak	Ya	Tidak	Tidak	Ya	Ya	Ya	Ya	Ya	Tidak	Tidak
https://www.sewakost.com/jakarta/selatan/kost-pelita-48234.html	Kost Pelita	5000000	Kost Campur	jl. bunga kenanga no. 24	Ya	Ya	Ya	Ya	Ya	Tidak	Ya	Tidak	Tidak	Ya	Ya	Ya	Ya	Ya	Tidak	Ya	Tidak	Ya	Ya
https://www.sewakost.com/jakarta/selatan/kosan-murah-tapi-nyaman-48538.html	KOSAN MURAH TAPI NYAMAN	2200000	Kost Campur	jl. kebayoran baru no 85	Ya	Ya	Ya	Tidak	Ya	Ya	Ya	Ya	Ya	Ya	Tidak	Ya	Ya	Ya	Ya	Ya	Ya	Ya	Ya
https://www.sewakost.com/jakarta/selatan/yoshie-kost-23549.html	Yoshie Kost	1600000	Kost Putri	Jalan keselamatan no.  3 rt 007/02 kel manggarai selatan kec Tebet Jakarta Selatan	Ya	Ya	Ya	Tidak	Ya	Tidak	Tidak	Tidak	Ya	Ya	Tidak	Tidak	Ya	Tidak	Tidak	Tidak	Tidak	Tidak	Tidak
https://www.sewakost.com/jakarta/selatan/griya-randi-kost-khusus-wanita-48404.html	GRIYA RANDI (kost khusus wanita)	2250000	Kost Putri	komplek MPR Jln Flamboyan no B 17 cilandak barat Jkt selatan (ancer2 : 1,5 km belakang citos)	Ya	Ya	Ya	Ya	Ya	Ya	Ya	Ya	Tidak	Tidak	Ya	Ya	Ya	Ya	Ya	Ya	Ya	Ya	Ya
https://www.sewakost.com/jakarta/selatan/kamar-kost-modern-minimalis-guntur-rasuna-said-jaksel-48397.html	kamar kost modern minimalis, guntur, rasuna said, jaksel	3000000	Kost Campur	jl. muria ujung no 45, psar manggis, setiabudi jakarta 12970	Ya	Ya	Ya	Ya	Ya	Tidak	Ya	Tidak	Ya	Ya	Ya	Ya	Ya	Ya	Ya	Ya	Tidak	Tidak	Tidak
https://www.sewakost.com/jakarta/selatan/kamar-kost-baru-modern-minimalis-guntur-rasuna-said-jaksel-48396.html	kamar kost baru modern minimalis, guntur, rasuna said, jaksel	2500000	Kost Campur	jl muria tanjakan gg c2 no 1, pasar manggis, setiabudi, jakarta	Ya	Ya	Ya	Ya	Ya	Tidak	Ya	Tidak	Ya	Ya	Tidak	Tidak	Ya	Ya	Ya	Tidak	Tidak	Tidak	Tidak
https://www.sewakost.com/jakarta/selatan/kamar-kos-dekat-darmawangsa-amp-ptik-48358.html	Kamar Kos dekat Darmawangsa & PTIK	3500000	Kost Campur	jl nipah 3 no 2, petogogan, kebayoran baru, jakarta selatan	Ya	Ya	Ya	Ya	Ya	Ya	Ya	Tidak	Tidak	Ya	Ya	Tidak	Ya	Ya	Tidak	Ya	Ya	Ya	Tidak
https://www.sewakost.com/jakarta/selatan/kost-lankosan21-jakarta-selatan-48346.html	KOST LANKOSAN21 JAKARTA SELATAN	1000000	Kost Campur	Jl. Pancoran Barat IV E No.13, RT.8/RW.1, Pancoran, Kec. Pancoran, Kota Jakarta Selatan, Daerah Khusus Ibukota Jakarta 12780	Tidak	Ya	Ya	Ya	Ya	Ya	Tidak	Tidak	Tidak	Ya	Ya	Tidak	Ya	Ya	Tidak	Tidak	Ya	Tidak	Tidak
https://www.sewakost.com/jakarta/selatan/terima-kost-putra-48311.html	Terima Kost Putra	650000	Kost Putra	Jl. Ps. Inpres No.38, RT.12/RW.3, Gandaria Utara, Kec. Kby. Baru, Kota Jakarta Selatan	Tidak	Tidak	Tidak	Ya	Tidak	Tidak	Tidak	Tidak	Tidak	Ya	Tidak	Tidak	Tidak	Tidak	Tidak	Tidak	Tidak	Tidak	Tidak
https://www.sewakost.com/jakarta/selatan/kost-ibu-ade-mampang-prapatan-jakarta-selatan-28974.html	KOST IBU ADE - Mampang Prapatan Jakarta Selatan	1500000	Kost Campur	Jl. Mampang Prapatan VII No.12 Tegal Parang Jakarta Selatan	Ya	Ya	Ya	Tidak	Tidak	Tidak	Tidak	Tidak	Tidak	Tidak	Tidak	Tidak	Tidak	Tidak	Tidak	Tidak	Tidak	Tidak	Tidak
https://www.sewakost.com/jakarta/selatan/kost-karyawati-jl-sungai-sambas-4-kebayoran-baru-jaksel-48147.html	Kost Karyawati Jl. Sungai Sambas 4, Kebayoran Baru, Jaksel	2000000	Kost Putri	Jl. Sungai Sambas 4 No.10, Kebayoran Baru, Jakarta Selatan	Ya	Ya	Tidak	Ya	Ya	Tidak	Tidak	Tidak	Tidak	Ya	Ya	Tidak	Ya	Tidak	Tidak	Tidak	Tidak	Tidak	Tidak
https://www.sewakost.com/jakarta/selatan/kost-jak-sel-murah-48141.html	KOST JAK-SEL MURAH	2000000	Kost Campur	Jl Petogogan 2 no 5a	Ya	Ya	Ya	Ya	Tidak	Tidak	Ya	Tidak	Ya	Ya	Tidak	Ya	Ya	Ya	Ya	Tidak	Ya	Tidak	Tidak
https://www.sewakost.com/jakarta/selatan/kost-“bungur-7”-residence-48102.html	Kost “Bungur 7” Residence	2300000	Kost Campur	Jl. Bungur 1 no.7 Rt.003 Rw.001 Kebayoran Lama Jakarta Selatan	Ya	Ya	Ya	Ya	Ya	Ya	Ya	Tidak	Ya	Ya	Ya	Tidak	Ya	Tidak	Ya	Ya	Ya	Tidak	Tidak
https://www.sewakost.com/jakarta/selatan/kost-setiabudi-f7-48100.html	KOST SETIABUDI F7	2350000	Kost Campur	Jalan Taman Setiabudi 1 Gang F no. 7 Rt.02 Rw 02  Kecamatan : Setiabudi  Kelurahan : Setiabudi  Jakarta Selatan 12910 (Lokasinya dekat Sman 3 setiabudi atau Mesjid, di seberang mesjid ada Gang F, Masuk gang tu sekitar 100 mete, Sudah myampe)	Ya	Ya	Ya	Ya	Ya	Tidak	Ya	Tidak	Tidak	Ya	Ya	Ya	Ya	Ya	Tidak	Tidak	Ya	Tidak	Ya
https://www.sewakost.com/jakarta/selatan/kost-disewakan-kost-putri-radio-dalam-kamboja-diskon-masa-cov19-40-50-info-lengkap-https-48068.html	KOST DISEWAKAN: Kost Putri Radio Dalam Kamboja ## Diskon Masa Cov19 40-50% ##  Info lengkap: https:/	1200000	Kost Putri	Gg.Musholla, Jl.Kamboja Radio Dalam JakSel	Ya	Ya	Ya	Tidak	Ya	Tidak	Tidak	Tidak	Ya	Tidak	Ya	Ya	Ya	Ya	Tidak	Tidak	Tidak	Ya	Ya
