https://www.sewakost.com/jakarta/selatan/kost-ibu-sri-pecel-67529.html	Kost Ibu Sri (Pecel)	700000	Kost Putri	Jl Camat Gabun II gg Jami RT 04/RW 08 No 47A kelurahan lenteng agung kecamatan jagakarsa, 12610	Tidak	Tidak	Ya	Ya	Tidak	Tidak	Tidak	Tidak	Ya	Ya	Tidak	Tidak	Ya	Tidak	Tidak	Tidak	Tidak	Tidak	Tidak
https://www.sewakost.com/jakarta/selatan/kost-haji-nawi-komplek-bank-mandiri-no-22-radio-dalam-67502.html	Kost Haji Nawi komplek bank mandiri no 22 Radio Dalam	1000000	Kost Putri	Kost Haji Nawi komplek bank manduru no 22 Radio dalam Gandaria Utara. Jakarta Selatan	Tidak	Tidak	Ya	Tidak	Tidak	Tidak	Tidak	Tidak	Tidak	Tidak	Tidak	Tidak	Ya	Tidak	Tidak	Tidak	Tidak	Tidak	Tidak
https://www.sewakost.com/jakarta/selatan/kost-strategis-area-jakarta-selatan-67150.html	Kost Strategis Area Jakarta Selatan	850000	Kost Campur	Jl. Lapangan Menara Air II NO. 21 RT 008/011 Kelurahan Manggarai Kecamatan Tebet	Tidak	Tidak	Tidak	Ya	Tidak	Tidak	Tidak	Tidak	Tidak	Ya	Ya	Ya	Tidak	Tidak	Tidak	Tidak	Tidak	Tidak	Tidak
https://www.sewakost.com/jakarta/selatan/g-house-pasar-baru-70227.html	G House Pasar Baru	1500000	Kost Campur	jl pintu besi I no 2 rt 10/ rw 5 ps baru jakarta pusat	Ya	Ya	Ya	Ya	Tidak	Ya	Ya	Tidak	Tidak	Ya	Ya	Ya	Ya	Ya	Tidak	Ya	Tidak	Tidak	Tidak
https://www.sewakost.com/jakarta/selatan/rumah-pondok-indah-70232.html	RUMAH PONDOK INDAH	2500000	Kost Campur	Jl. Metro Alam V, RT.11/ RW.16, Pd.Pinang, Kec.Kby Lama, Kota Jakarta Seletan, 12310	Ya	Ya	Ya	Ya	Ya	Ya	Ya	Tidak	Tidak	Ya	Ya	Ya	Ya	Tidak	Tidak	Ya	Tidak	Ya	Tidak
https://www.sewakost.com/jakarta/selatan/kaya-house-pluit-70230.html	KAYA HOUSE PLUIT	2500000	Kost Campur	Jl. Pluit Permai 8 No 11,RT.3 / RW04,Pluit,Kec. Penjaringan,Jakarta Utara,14450	Ya	Ya	Ya	Ya	Ya	Tidak	Ya	Tidak	Tidak	Ya	Tidak	Tidak	Ya	Tidak	Tidak	Tidak	Tidak	Ya	Tidak
https://www.sewakost.com/jakarta/selatan/kost-lotte-kuningan-42a-70228.html	KOST LOTTE KUNINGAN 42A	1000000	Kost Campur	Jl. Guru mugni Gg. Bates no. 42A belakang lotte kuningan, jakarta selatan	Ya	Ya	Ya	Ya	Tidak	Tidak	Tidak	Tidak	Tidak	Ya	Tidak	Tidak	Ya	Tidak	Tidak	Tidak	Tidak	Tidak	Tidak
https://www.sewakost.com/jakarta/selatan/kost-putri-70197.html	kost Putri	800000	Kost Putri	Jl.Lagga raya no.62 Rt,011/02 Lenteng Agung, Jagakarsa	Tidak	Tidak	Ya	Ya	Tidak	Tidak	Tidak	Tidak	Tidak	Ya	Tidak	Tidak	Tidak	Tidak	Tidak	Tidak	Tidak	Tidak	Tidak
https://www.sewakost.com/jakarta/selatan/kosputrikemang-70050.html	Kosputrikemang	2000000	Kost Putri	Jl. Kemang Selatan IX no. 20 Rt 01 Rw 02 Kel.Bangka Kec. Mampang Prapatan Jaksel	Ya	Ya	Ya	Ya	Tidak	Ya	Tidak	Ya	Ya	Ya	Tidak	Tidak	Ya	Ya	Tidak	Tidak	Tidak	Tidak	Tidak
https://www.sewakost.com/jakarta/selatan/kos-h-arduih-tipe-d-67107.html	Kos H. Arduih tipe D	1600000	Kost Campur	Jl. Cipete Raya, Komplek BRI, Demuna Ujung, Rt. 09/06 no. 47, Jak Sel	Ya	Ya	Ya	Ya	Tidak	Tidak	Tidak	Tidak	Tidak	Ya	Tidak	Tidak	Ya	Tidak	Tidak	Tidak	Tidak	Tidak	Tidak
https://www.sewakost.com/jakarta/selatan/insula-kost-kalibata-selatan-i-kost-putra-fasilitas-baru-67082.html	Insula Kost Kalibata Selatan I (Kost Putra Fasilitas Baru)	2000000	Kost Putra	Jl. Kalibata Selatan 1 No.4, Kalibata , Kec. Pancoran, Jakarta Selatan	Ya	Ya	Ya	Tidak	Ya	Tidak	Tidak	Tidak	Tidak	Ya	Tidak	Tidak	Tidak	Tidak	Tidak	Ya	Tidak	Ya	Tidak
https://www.sewakost.com/jakarta/selatan/kos-murah-dekat-scbd-66987.html	Kos murah dekat SCBD	1000000	Kost Putra	Jl rengas 1 RT 005 RW 002 No 44 Kebayoran baru jaksel	Tidak	Tidak	Ya	Ya	Tidak	Tidak	Tidak	Tidak	Tidak	Ya	Tidak	Tidak	Tidak	Tidak	Tidak	Tidak	Tidak	Tidak	Tidak
https://www.sewakost.com/jakarta/selatan/hmr-guest-house-tebet-jakarta-selatan-66821.html	HMR Guest House Tebet Jakarta Selatan	1500000	Kost Campur	JL Tebet Utara I Gang Staff 8 RT.003 RW.010 Kelurahan Tebet Timur Kecamatan Tebet Jakarta Selatan	Ya	Ya	Ya	Tidak	Tidak	Tidak	Tidak	Tidak	Tidak	Tidak	Tidak	Tidak	Tidak	Tidak	Tidak	Tidak	Tidak	Tidak	Tidak
https://www.sewakost.com/jakarta/selatan/kostan-murah-gratis-wifi-dekat-kampus-budiluhur-66701.html	Kostan murah gratis wifi dekat kampus budiluhur	600000	Kost Campur	jl sabar raya 1 no 23 rt 9 rw 4	Tidak	Ya	Tidak	Tidak	Tidak	Tidak	Tidak	Tidak	Tidak	Ya	Ya	Ya	Ya	Tidak	Tidak	Tidak	Tidak	Tidak	Ya
https://www.sewakost.com/jakarta/selatan/kost-strategis-di-cipete-dekat-fatmawati-dan-antasari-66368.html	Kost strategis di Cipete, dekat Fatmawati dan Antasari	1600000	Kost Campur	Jl. Puri Kencana no.64 RT.011/RW.006 Cipete Selatan , Cilandak, Jakarta Selatan (12410)	Ya	Ya	Ya	Ya	Ya	Tidak	Tidak	Tidak	Tidak	Ya	Tidak	Tidak	Ya	Ya	Ya	Tidak	Tidak	Tidak	Tidak
https://www.sewakost.com/jakarta/selatan/amanah-kos-66639.html	Amanah kos	2000000	Kost Campur	Jalan sawo kecik 9 bukit duri tebet jakarta selatan	Ya	Ya	Ya	Ya	Ya	Ya	Tidak	Ya	Ya	Ya	Ya	Ya	Ya	Tidak	Tidak	Tidak	Tidak	Tidak	Ya
https://www.sewakost.com/jakarta/selatan/guds-08-kost-room-1-66532.html	Guds 08 Kost - Room 1	2200000	Kost Campur	Gudang Peluru Raya B1 No.8, Tebet, Jakarta Selatan, 12830	Ya	Ya	Ya	Ya	Tidak	Tidak	Tidak	Tidak	Tidak	Ya	Ya	Tidak	Ya	Ya	Tidak	Tidak	Tidak	Ya	Ya
https://www.sewakost.com/jakarta/selatan/kost-pria-dekat-stasiun-palmerah-kemandoran-1-jakarta-selatan-murah-amp-bersih-66383.html	Kost PRIA dekat STASIUN PALMERAH, Kemandoran 1, Jakarta Selatan, Murah & Bersih	800000	Kost Putra	RUMAH KOS SULARTO, Jalan Pulo Melati I No. 5B, RT.05/016, Kel. Grogol Utara, Kec. Kebayoran Lama, Jakarta Selatan 12210.	Tidak	Ya	Tidak	Ya	Ya	Tidak	Tidak	Tidak	Ya	Ya	Tidak	Tidak	Ya	Tidak	Ya	Tidak	Ya	Tidak	Tidak
https://www.sewakost.com/jakarta/selatan/kost-rumah-praja-daerah-elit-arteri-pondok-indah-jakarta-selatan-66347.html	Kost Rumah Praja - daerah Elit - Arteri Pondok Indah, Jakarta Selatan	2200000	Kost Campur	Jl. Praja No.20, Arteri Pondok Indah / Iskandar Muda, Jakarta Selatan	Ya	Ya	Ya	Ya	Ya	Ya	Ya	Tidak	Ya	Ya	Tidak	Tidak	Ya	Ya	Ya	Ya	Ya	Tidak	Tidak
https://www.sewakost.com/jakarta/selatan/kost-exclusive-di-jl-al-barkah-13-rt09-rw03-tebet-manggarai-selatan-13875.html	Kost Exclusive di jl. Al-barkah 13 RT09/RW03 (TEBET) Manggarai Selatan	2400000	Kost Putri	Jalan AlBarkah 13 RT09/RW03	Ya	Ya	Ya	Ya	Ya	Ya	Tidak	Tidak	Ya	Ya	Tidak	Tidak	Ya	Tidak	Tidak	Ya	Tidak	Tidak	Tidak
https://www.sewakost.com/jakarta/selatan/kost-baru-dan-bersih-66357.html	Kost Baru dan Bersih 	1000000	Kost Campur	Tebet	Ya	Ya	Ya	Tidak	Tidak	Tidak	Tidak	Tidak	Tidak	Ya	Tidak	Tidak	Tidak	Tidak	Tidak	Tidak	Tidak	Tidak	Tidak
https://www.sewakost.com/jakarta/selatan/kost-terjangkau-cipete-utara-jakarta-selatan-65968.html	Kost Terjangkau Cipete Utara, Jakarta Selatan	1500000	Kost Putri	Jl. Saraswati RT 002/011 no 16 Cipete Utara, Kebayoran Baru, Jakarta Selatan	Ya	Tidak	Ya	Tidak	Tidak	Tidak	Tidak	Tidak	Ya	Ya	Tidak	Tidak	Ya	Tidak	Tidak	Tidak	Tidak	Tidak	Tidak
https://www.sewakost.com/jakarta/selatan/kos-khusus-putri-yang-aman-dan-tenang-dekat-lenteng-agung-66229.html	Kos khusus putri yang aman dan tenang dekat lenteng agung	700000	Kost Putri	Jalan srengseng sawah kecamatan jagakarsa (Sebelah kampus ISTN jakarta)	Ya	Tidak	Tidak	Tidak	Tidak	Ya	Tidak	Tidak	Ya	Ya	Ya	Tidak	Ya	Ya	Tidak	Tidak	Tidak	Tidak	Ya
https://www.sewakost.com/jakarta/selatan/kost-bunda-66211.html	Kost Bunda	2000000	Kost Campur	Jl. Tebet Barat Dalam IX	Ya	Ya	Ya	Ya	Tidak	Tidak	Tidak	Tidak	Tidak	Tidak	Ya	Tidak	Tidak	Ya	Tidak	Tidak	Tidak	Tidak	Tidak
https://www.sewakost.com/jakarta/selatan/kontrakan-dekat-seskoal-cipulir-66104.html	Kontrakan dekat SESKOAL Cipulir	1800000	Kost Pasutri	Jl. Ciledug Raya Cipulir Keb.Lama Jakarta Selatan	Tidak	Tidak	Ya	Tidak	Tidak	Tidak	Tidak	Tidak	Tidak	Tidak	Tidak	Tidak	Tidak	Tidak	Tidak	Tidak	Tidak	Tidak	Tidak
https://www.sewakost.com/jakarta/selatan/kost-griya-madani-jakarta-66003.html	Kost Griya Madani Jakarta	850000	Kost Campur	Jl. Bangka Raya No. 19 RT 008/RW 011 Kelurahan Pela Mampang Kecamatan Mampang Prapatan Jakarta Selatan	Tidak	Ya	Tidak	Tidak	Tidak	Tidak	Tidak	Ya	Ya	Ya	Tidak	Tidak	Tidak	Ya	Tidak	Ya	Tidak	Tidak	Tidak
https://www.sewakost.com/jakarta/selatan/flamboyan-residence-70190.html	FLAMBOYAN RESIDENCE	4500000	Kost Campur	Jl. Bunga Flamboyan No.30, RT.14/RW.5, Cipete Sel., Kec. Cilandak, Kota Jakarta Selatan, Daerah Khusus Ibukota Jakarta 12410	Ya	Ya	Ya	Ya	Ya	Ya	Ya	Tidak	Ya	Ya	Ya	Tidak	Ya	Ya	Tidak	Ya	Tidak	Tidak	Tidak
https://www.sewakost.com/jakarta/selatan/flamboyan-residence-65923.html	FLAMBOYAN RESIDENCE	4500000	Kost Campur	jl bunga flamboyan no 30 rt 14/rw 5 cipete selatan, cilandak kota jakarta selatan	Ya	Ya	Ya	Ya	Ya	Ya	Ya	Tidak	Ya	Ya	Ya	Tidak	Ya	Ya	Ya	Ya	Tidak	Tidak	Tidak
https://www.sewakost.com/jakarta/selatan/kost-lotte-kuningan-42a-65920.html	KOST LOTTE KUNINGAN 42A	1200000	Kost Campur	Jl. Guru mugni Gg. Bates no. 42A belakang lotte kuningan	Ya	Ya	Ya	Ya	Ya	Tidak	Tidak	Tidak	Tidak	Ya	Tidak	Tidak	Ya	Tidak	Ya	Tidak	Ya	Tidak	Tidak
https://www.sewakost.com/jakarta/selatan/kost-di-tebet-dekat-st-cawang-65807.html	Kost di tebet dekat st cawang	2000000	Kost Campur	Jl tebet timur dalam 7G	Ya	Tidak	Ya	Ya	Tidak	Tidak	Tidak	Tidak	Tidak	Tidak	Tidak	Tidak	Tidak	Tidak	Tidak	Tidak	Tidak	Tidak	Tidak
https://www.sewakost.com/jakarta/selatan/kost-di-tebet-dekat-st-cawang-65806.html	Kost di tebet dekat st cawang	750000	Kost Putra	Jl tebet timur dalam 7G	Tidak	Tidak	Tidak	Tidak	Tidak	Tidak	Tidak	Tidak	Tidak	Tidak	Tidak	Tidak	Tidak	Tidak	Tidak	Tidak	Tidak	Tidak	Tidak
https://www.sewakost.com/jakarta/selatan/hakkost-abdul-majid-dalam-iii-29-65746.html	Hakkost - Abdul Majid Dalam III/29	2500000	Kost Campur	Jalan Abdul Majid Dalam IIi/29, Kompleks DEPLU, Jakarta Selatan	Ya	Ya	Ya	Ya	Ya	Tidak	Ya	Tidak	Tidak	Ya	Tidak	Ya	Ya	Ya	Tidak	Tidak	Ya	Tidak	Ya
https://www.sewakost.com/jakarta/selatan/kost-jaksel-ac-dan-non-ac-free-listrik-air-parkir-luas-65655.html	Kost jaksel ac dan non ac free listrik air parkir luas	900000	Kost Pasutri	Jagakarsa ciganjur	Ya	Ya	Ya	Ya	Ya	Ya	Tidak	Tidak	Ya	Ya	Ya	Tidak	Ya	Tidak	Tidak	Ya	Tidak	Ya	Ya
https://www.sewakost.com/jakarta/selatan/kost-setiabudi-campur-dekat-mrt-65646.html	Kost Setiabudi - campur dekat MRT	1600000	Kost Campur	Jl. O Karet Belakang RT14/RW02 No. 16-17, Karet-Setiabudi	Ya	Tidak	Ya	Ya	Ya	Tidak	Tidak	Tidak	Ya	Tidak	Tidak	Tidak	Tidak	Ya	Ya	Tidak	Ya	Tidak	Tidak
https://www.sewakost.com/jakarta/selatan/kos-pondok-pinang-jaksel-65570.html	Kos pondok pinang jaksel	650000	Kost Campur	Jl tanah ara 2 RT 4 RW 12 no 16 pondok pinang jaksel	Tidak	Tidak	Tidak	Tidak	Tidak	Tidak	Tidak	Tidak	Tidak	Tidak	Tidak	Tidak	Tidak	Tidak	Tidak	Tidak	Tidak	Tidak	Tidak
https://www.sewakost.com/jakarta/selatan/rumah-kost-tenang-amp-nyaman-di-cilandak-jakarta-selatan-65509.html	Rumah Kost Tenang & Nyaman di Cilandak Jakarta Selatan	1850000	Kost Campur	Jalan Cilandak X Nomor 11	Ya	Ya	Ya	Ya	Ya	Tidak	Ya	Tidak	Tidak	Ya	Tidak	Ya	Ya	Ya	Tidak	Ya	Tidak	Tidak	Tidak
https://www.sewakost.com/jakarta/selatan/kost-strategis-kemang-bangka-jks-65371.html	Kost Strategis Kemang - Bangka JKS	1500000	Kost Campur	jl. Bangka 3 no.38 Pelamampang Jakarta selatan	Ya	Ya	Tidak	Ya	Ya	Tidak	Tidak	Tidak	Tidak	Ya	Tidak	Tidak	Tidak	Tidak	Tidak	Tidak	Tidak	Tidak	Tidak
https://www.sewakost.com/jakarta/selatan/wisma-pondok-karya-kost-karyawan-putra-60567.html	Wisma Pondok Karya Kost Karyawan Putra	1200000	Kost Putra	Jalan Pondok Karya V Blok i No 58 RT 08 RW 04 Pela Mampang Jakarta Selatan	Tidak	Ya	Ya	Ya	Ya	Tidak	Tidak	Tidak	Ya	Ya	Ya	Tidak	Tidak	Ya	Tidak	Ya	Tidak	Tidak	Tidak
https://www.sewakost.com/jakarta/selatan/kost-jakarta-selatan-tanjung-barat-simatupang-39880.html	Kost Jakarta Selatan Tanjung Barat Simatupang	1600000	Kost Campur	Jl. H Matali, Rancho Indah Tanjung Barat RT02/02 No 79 Jakarta Selatan 12530 (Kejaksaan Negeri Jakarta Selatan)	Ya	Ya	Ya	Ya	Ya	Tidak	Tidak	Tidak	Tidak	Ya	Ya	Ya	Ya	Ya	Tidak	Tidak	Tidak	Tidak	Ya
https://www.sewakost.com/jakarta/selatan/east-16-kost-residence-65234.html	East 16 Kost Residence 	3750000	Kost Campur	Jl. Setiabudi Timur 1 no 6 – Jakarta Selatan	Ya	Ya	Ya	Tidak	Tidak	Ya	Ya	Tidak	Ya	Ya	Ya	Tidak	Ya	Tidak	Tidak	Ya	Tidak	Tidak	Tidak
https://www.sewakost.com/jakarta/selatan/kost-kostan-radio-dalam-52749.html	Kost-kostan radio dalam	1800000	Kost Campur	Jln. Radio dalam, Antena 5, Gandaria Utara, Kebayoran Baru, Jakarta Selatan	Ya	Ya	Ya	Tidak	Tidak	Tidak	Tidak	Tidak	Tidak	Tidak	Tidak	Tidak	Tidak	Tidak	Tidak	Tidak	Tidak	Tidak	Tidak
https://www.sewakost.com/jakarta/selatan/kost-strategis-di-pancoran-65222.html	kost strategis di pancoran	1500000	Kost Putra	Jl. Pancoran Barat IV A No. 29 Rt 006 Rw 01 Pancoran Jakarta Selatan	Ya	Ya	Ya	Ya	Ya	Tidak	Tidak	Tidak	Tidak	Ya	Tidak	Tidak	Ya	Tidak	Tidak	Tidak	Ya	Ya	Tidak
https://www.sewakost.com/jakarta/selatan/kost-wanita-jakarta-selatan-65206.html	Kost wanita jakarta selatan	850000	Kost Putri	Jln bahari raya no 23 rt 12 rw 07	Tidak	Ya	Tidak	Ya	Tidak	Tidak	Tidak	Tidak	Tidak	Ya	Ya	Ya	Ya	Tidak	Tidak	Tidak	Tidak	Ya	Tidak
https://www.sewakost.com/jakarta/selatan/sewa-kamar-kost-daerah-cipulir-seskoal-kebayoran-lama-jakarta-selatan-2005.html	Sewa Kamar Kost daerah  Cipulir SESKOAL Kebayoran Lama Jakarta Selatan	1150000	Kost Campur	Jl. Ciledug Raya Cipulir Keb. Lama Jakarta Selatan 12230 (samping Roti Bakar 88) sebelum SESKOAL arah Ciledug	Tidak	Tidak	Ya	Ya	Tidak	Tidak	Tidak	Tidak	Tidak	Ya	Tidak	Tidak	Tidak	Tidak	Tidak	Tidak	Tidak	Tidak	Tidak
https://www.sewakost.com/jakarta/selatan/kost-rumah-kita-65133.html	Kost Rumah Kita	1800000	Kost Putri	Pondok Jaya 3 No 1A, Pela Mampang, Mampang Prapatan, Jaksel	Ya	Ya	Ya	Ya	Ya	Tidak	Tidak	Tidak	Tidak	Ya	Tidak	Tidak	Tidak	Tidak	Tidak	Tidak	Tidak	Tidak	Tidak
https://www.sewakost.com/jakarta/selatan/casa-tebet-mas-indah-tipe-deluxe-64839.html	Casa Tebet Mas Indah tipe deluxe	3200000	Kost Putri	Jln Tebet Mas Indah III No A7 Rt 009/Rw 002	Ya	Ya	Ya	Ya	Tidak	Tidak	Ya	Tidak	Ya	Ya	Ya	Tidak	Ya	Tidak	Tidak	Ya	Tidak	Tidak	Tidak
https://www.sewakost.com/jakarta/selatan/kost-putri-griya-tara-64770.html	KOST PUTRI GRIYA TARA	1000000	Kost Putri	Jalan Nimun Raya No.4, Tanah Kusir, kebayoran lama selatan , jakarta selatan, 12240	Ya	Ya	Ya	Ya	Ya	Tidak	Tidak	Tidak	Ya	Ya	Ya	Ya	Ya	Tidak	Tidak	Tidak	Tidak	Tidak	Ya
https://www.sewakost.com/jakarta/selatan/krista-home-64647.html	Krista Home	1500000	Kost Campur	Jl andara raya no 20 pangkalan jati baru cinere	Ya	Ya	Ya	Ya	Tidak	Tidak	Tidak	Tidak	Ya	Ya	Ya	Tidak	Ya	Ya	Tidak	Ya	Tidak	Ya	Tidak
https://www.sewakost.com/jakarta/selatan/kost-fasilitas-lengkap-daerah-setiabudi-jakarta-selatan-64665.html	Kost fasilitas Lengkap Daerah Setiabudi Jakarta Selatan	2500000	Kost Campur	Jl. Setiabudi tengah no. 3 Jakarta Selatan 12910	Ya	Ya	Ya	Ya	Ya	Ya	Ya	Tidak	Tidak	Ya	Tidak	Tidak	Tidak	Tidak	Ya	Ya	Tidak	Tidak	Tidak
https://www.sewakost.com/jakarta/selatan/lebak-bulus-9a-c0-living-64370.html	Lebak Bulus 9A C0-Living 	5000000	Kost Campur	Jalan Lebak Bulus IV no. 9A, Cilandak, Jakarta Selatan	Ya	Ya	Ya	Ya	Ya	Tidak	Ya	Tidak	Ya	Ya	Tidak	Ya	Ya	Ya	Tidak	Ya	Tidak	Ya	Tidak
https://www.sewakost.com/jakarta/selatan/kost-omah-eyang-fatmawati-jakarta-selatan-64430.html	Kost Omah Eyang Fatmawati Jakarta Selatan	1000000	Kost Putri	Jalan gotong royong 2 no 6 gandaria utara kebayoran baru Jakarta Selatan	Ya	Ya	Tidak	Ya	Ya	Ya	Tidak	Tidak	Ya	Ya	Ya	Ya	Ya	Tidak	Tidak	Tidak	Tidak	Tidak	Tidak
https://www.sewakost.com/jakarta/selatan/homestay-aman-amp-nyaman-64402.html	Homestay aman & nyaman 	3500000	Kost Campur	Jl jaya mandal raya no 889	Ya	Ya	Ya	Ya	Ya	Ya	Ya	Tidak	Ya	Ya	Ya	Ya	Ya	Ya	Tidak	Ya	Ya	Tidak	Tidak
https://www.sewakost.com/jakarta/selatan/kost-pria-muslim-murah-cilandak-ragunan-jaksel-bu-maman-64328.html	 Kost Pria Muslim murah, Cilandak Ragunan Jaksel (Bu Maman)	700000	Kost Putra	Jl. Cilandak KKO Gg. Cemara bawah /Gg. Abbah bawah Rt. 007 Rw. 05 NO. 26 Ragunan Pasar Minggu Jakarta Selatan 12550	Tidak	Tidak	Tidak	Ya	Ya	Tidak	Tidak	Tidak	Tidak	Ya	Ya	Tidak	Ya	Tidak	Tidak	Tidak	Tidak	Ya	Tidak
https://www.sewakost.com/jakarta/selatan/kosan-bapak-gareng-setiabudi-64327.html	Kosan Bapak Gareng SetiaBudi	1500000	Kost Campur	Jl. Menteng atas Rt. 06 Rw. 12	Tidak	Tidak	Tidak	Tidak	Tidak	Tidak	Tidak	Tidak	Tidak	Tidak	Tidak	Tidak	Tidak	Tidak	Tidak	Tidak	Tidak	Tidak	Tidak
https://www.sewakost.com/jakarta/selatan/kost-kamar-64299.html	kost kamar	2900000	Kost Putri	jl. hang lekir XII No.11 Kebayoran Baru Jaksel	Ya	Tidak	Ya	Ya	Ya	Ya	Tidak	Tidak	Tidak	Tidak	Tidak	Tidak	Tidak	Tidak	Tidak	Ya	Tidak	Tidak	Tidak
https://www.sewakost.com/jakarta/selatan/kost-mampang-prapatan-tendean-kuningan-blok-m-kemang-pancoran-64281.html	Kost Mampang Prapatan Tendean Kuningan Blok M Kemang Pancoran	1650000	Kost Campur	Jl. Pondok Jaya IX No. 22B, Mampang Prapatan 7 - Jakarta Selatan	Ya	Ya	Ya	Ya	Ya	Tidak	Tidak	Tidak	Ya	Ya	Ya	Tidak	Ya	Tidak	Tidak	Ya	Tidak	Tidak	Tidak
https://www.sewakost.com/jakarta/selatan/kost-murah-jakarta-selatan-64186.html	Kost Murah Jakarta Selatan	500000	Kost Putra	Jl. Pondok Jaya 3 No.14A	Tidak	Tidak	Tidak	Tidak	Tidak	Tidak	Tidak	Tidak	Tidak	Tidak	Tidak	Tidak	Tidak	Tidak	Tidak	Tidak	Tidak	Tidak	Tidak
https://www.sewakost.com/jakarta/selatan/kost-premium-radio-dalam-jakarta-selatan-63808.html	Kost Premium Radio Dalam Jakarta Selatan	2800000	Kost Campur	Jalan Taman Radio Dalam I no 5	Ya	Ya	Ya	Ya	Ya	Ya	Ya	Tidak	Ya	Ya	Ya	Ya	Ya	Ya	Tidak	Ya	Tidak	Tidak	Ya
https://www.sewakost.com/jakarta/selatan/kost-terjangkau-asri-dan-nyaman-di-ampera-dan-tb-simatupang-63294.html	Kost terjangkau, asri dan nyaman di ampera dan tb simatupang	3000000	Kost Campur	Jl. Jeruk purut no.22 RT 5/3, Cilandak Timur, Pasar Minggu.	Ya	Ya	Ya	Ya	Tidak	Ya	Ya	Tidak	Ya	Ya	Ya	Ya	Ya	Ya	Tidak	Ya	Tidak	Tidak	Tidak
https://www.sewakost.com/jakarta/selatan/sewa-kost-63356.html	sewa kost	1950000	Kost Putri	Jalan  Batu 1 no 21 RT 11 RW 01	Ya	Ya	Ya	Ya	Ya	Tidak	Tidak	Tidak	Tidak	Ya	Tidak	Tidak	Tidak	Tidak	Tidak	Tidak	Tidak	Tidak	Tidak
https://www.sewakost.com/jakarta/selatan/safira-kostel-free-wifi-800-per-bulan-63307.html	Safira kostel free wifi 800 per bulan	800000	Kost Putra	Jl Attahiriyah 2 no 22 rt 12/03 pejaten barat, pasar minggu, jakarta selatan	Tidak	Ya	Ya	Ya	Tidak	Tidak	Tidak	Tidak	Ya	Ya	Ya	Tidak	Ya	Tidak	Tidak	Tidak	Tidak	Tidak	Tidak
https://www.sewakost.com/jakarta/selatan/kost-terjangkau-jakarta-selatan-59724.html	Kost Terjangkau Jakarta Selatan	1800000	Kost Campur	Gg H Leman No 112B Jalan Tanah Kusir II	Ya	Ya	Ya	Ya	Ya	Ya	Ya	Ya	Ya	Ya	Ya	Ya	Ya	Tidak	Tidak	Tidak	Tidak	Tidak	Tidak
https://www.sewakost.com/jakarta/selatan/kost-putri-duren-tiga-mampang-63265.html	Kost Putri Duren Tiga, Mampang	1400000	Kost Putri	Jl. Mampang Prapatan 18, Rt 008, Rw 05, No. 3B, Durentiga, Pancoran, Jakarta Selatan	Ya	Ya	Ya	Ya	Ya	Tidak	Tidak	Tidak	Tidak	Tidak	Tidak	Tidak	Tidak	Tidak	Tidak	Tidak	Tidak	Tidak	Tidak
https://www.sewakost.com/jakarta/selatan/rumah-kost-karyawati-pasutri-baru-di-jl-keselamatan-18-tebet-17834.html	Rumah kost Karyawati, pasutri baru  di  jl keselamatan 18 (TEBET) 	1750000	Kost Campur	Jalan Keselamatan 18 RT09/RW03 (Tebet)	Ya	Ya	Ya	Ya	Tidak	Tidak	Tidak	Tidak	Ya	Ya	Tidak	Tidak	Ya	Tidak	Tidak	Tidak	Tidak	Tidak	Tidak
https://www.sewakost.com/jakarta/selatan/kos-mampang-duren-tiga-kuningan-tendean-gatot-subroto-sudirman-blok-m-kebayoran-baru-63223.html	Kos mampang duren tiga kuningan tendean gatot subroto sudirman blok m kebayoran baru	2000000	Kost Campur	Jl. Mampang Prapatan XVIII PLK No.38	Ya	Ya	Ya	Ya	Ya	Tidak	Tidak	Tidak	Tidak	Ya	Ya	Ya	Ya	Ya	Ya	Tidak	Tidak	Tidak	Tidak
https://www.sewakost.com/jakarta/selatan/kos-modern-nyaman-omah-eyang-kebayoran-jaksel-63199.html	Kos modern nyaman Omah Eyang Kebayoran Jaksel	2800000	Kost Putri	Jl Benda 1 N0 10, pulo, Kebayoran Baru, Jaksel	Ya	Ya	Ya	Ya	Tidak	Ya	Ya	Tidak	Ya	Ya	Ya	Ya	Ya	Ya	Ya	Tidak	Ya	Ya	Tidak
https://www.sewakost.com/jakarta/selatan/di-jual-di-sewakan-kost-bang-ori-63198.html	Di jual / Di sewakan Kost Bang Ori	1400000	Kost Putri	Jl.Kembang No. 40, Kwitang, Kec senen, Kota Jakarta Pusat	Ya	Ya	Ya	Ya	Tidak	Ya	Tidak	Tidak	Ya	Tidak	Tidak	Tidak	Tidak	Tidak	Tidak	Tidak	Tidak	Tidak	Tidak
https://www.sewakost.com/jakarta/selatan/biliq-u-kostel-63075.html	BILIQ U KOSTEL	3650000	Kost Putri	Jl. Asem 2 Komplek BKI B No. 5, Cipete Selatan, Jakarta Selatan, DKI Jakarta	Ya	Ya	Ya	Ya	Ya	Ya	Ya	Tidak	Ya	Ya	Ya	Ya	Ya	Ya	Ya	Ya	Tidak	Tidak	Ya
https://www.sewakost.com/jakarta/selatan/kost-murah-nyaman-dan-resik-62963.html	Kost Murah, Nyaman dan Resik	1500000	Kost Campur	Jalan Rusa I no 25, Manggarai Selatan, Tebet, Jakarta Selatan	Ya	Ya	Ya	Ya	Ya	Tidak	Tidak	Tidak	Tidak	Ya	Tidak	Tidak	Ya	Tidak	Tidak	Tidak	Tidak	Tidak	Tidak
https://www.sewakost.com/jakarta/selatan/kost-putri-terogong-62964.html	KOST PUTRI - Terogong 	1300000	Kost Putri	Jl. Terogong (Gg. Alit II) - Fatmawati	Ya	Tidak	Ya	Ya	Ya	Tidak	Tidak	Tidak	Tidak	Ya	Tidak	Tidak	Ya	Tidak	Tidak	Ya	Tidak	Ya	Tidak
https://www.sewakost.com/jakarta/selatan/kost-tebet-timur-seperti-apartemen-studio-62950.html	Kost Tebet Timur Seperti Apartemen Studio	2700000	Kost Campur	Jl. Tebet Timur Dalam, Tebet, Jakarta Selatan	Ya	Ya	Ya	Tidak	Tidak	Ya	Ya	Ya	Tidak	Ya	Tidak	Tidak	Tidak	Tidak	Tidak	Tidak	Tidak	Tidak	Tidak
https://www.sewakost.com/jakarta/selatan/kost-eksklusif-radio-dalam-62935.html	kost eksklusif radio dalam	2800000	Kost Campur	jl. anggrek no. 2 radio dalam	Ya	Ya	Ya	Ya	Ya	Ya	Ya	Tidak	Ya	Ya	Tidak	Tidak	Ya	Tidak	Tidak	Ya	Tidak	Tidak	Tidak
https://www.sewakost.com/jakarta/selatan/kost-63-non-ac-kmr-hadap-taman-khusus-pria-cilandak-dekat-sta-mrt-fmwti-pintu-tol-mall-citos-62863.html	KOST 63 NON AC (KMR HADAP TAMAN) KHUSUS PRIA, CILANDAK, DEKAT STA MRT FMWTI, PINTU TOL MALL CITOS	700000	Kost Putra	Jl H Subuh no 63 Cilandak Timur Pasar Minggi. Iakarta Selatan	Tidak	Tidak	Tidak	Ya	Ya	Tidak	Tidak	Ya	Ya	Ya	Tidak	Tidak	Ya	Tidak	Tidak	Tidak	Ya	Ya	Tidak
https://www.sewakost.com/jakarta/selatan/basender-living-kost-59297.html	Basender Living Kost	2200000	Kost Campur	Jln. PANCORAN BARAT 6 No. B.43 RT/RW 010/006 Kelurahan PANCORAN Kecamatan PANCORAN Jakarta Selatan 12780	Ya	Ya	Ya	Ya	Ya	Ya	Ya	Ya	Tidak	Ya	Ya	Ya	Ya	Ya	Tidak	Tidak	Tidak	Tidak	Ya
https://www.sewakost.com/jakarta/selatan/kemang-eleven-homestay-62810.html	Kemang Eleven Homestay	4000000	Kost Campur	Jl. Kemang Raya No.11, Bangka, Mampang Prapatan, Jakarta Selatan	Ya	Ya	Ya	Ya	Ya	Ya	Ya	Ya	Ya	Ya	Ya	Ya	Ya	Ya	Ya	Ya	Tidak	Tidak	Tidak
https://www.sewakost.com/jakarta/selatan/kos-muslimah-rumah-nadine-48566.html	Kos Muslimah RUMAH NADINE	2300000	Kost Putri	JL Pepaya No 5 RT 3 RW 6 Pejaten Barat Ps Minggu Jakarta Selatan (Belakang Circle K)	Ya	Ya	Ya	Tidak	Tidak	Tidak	Tidak	Tidak	Tidak	Tidak	Tidak	Tidak	Tidak	Tidak	Tidak	Tidak	Tidak	Tidak	Tidak
https://www.sewakost.com/jakarta/selatan/kos-pet-friendly-62646.html	Kos Pet Friendly	3500000	Kost Putri	Jl. Kemang I	Ya	Ya	Ya	Ya	Ya	Ya	Ya	Ya	Tidak	Ya	Ya	Ya	Ya	Ya	Ya	Ya	Ya	Tidak	Tidak
https://www.sewakost.com/jakarta/selatan/kost-murah-ibu-siti-urpiyah-dekat-pangeran-antasari-jakarta-selatan-62615.html	Kost Murah Ibu Siti Urpiyah dekat Pangeran Antasari Jakarta Selatan	950000	Kost Campur	Jl. Kh Naim 1 rt 04/11 No 16 cipete Jakarta selatan	Tidak	Tidak	Ya	Ya	Tidak	Tidak	Tidak	Tidak	Tidak	Ya	Tidak	Tidak	Ya	Tidak	Tidak	Tidak	Tidak	Tidak	Tidak
https://www.sewakost.com/jakarta/selatan/zahira-house-62058.html	Zahira house	3500000	Kost Campur	Tebet barat 8 no 35	Ya	Ya	Ya	Ya	Tidak	Ya	Ya	Ya	Ya	Ya	Ya	Tidak	Ya	Tidak	Tidak	Ya	Tidak	Ya	Ya
https://www.sewakost.com/jakarta/selatan/gs-kost-kebayoran-lama-jakarta-selatan-62604.html	GS Kost Kebayoran Lama Jakarta Selatan	950000	Kost Campur	Jl. AA no.12 rt.11 rw.03 samping TIKI dan musholla Al Amin Pos Pengumben JKebayoran Lama, Jakarta Selatan	Ya	Tidak	Ya	Ya	Ya	Tidak	Tidak	Tidak	Ya	Ya	Tidak	Tidak	Ya	Tidak	Ya	Ya	Tidak	Tidak	Tidak
https://www.sewakost.com/jakarta/selatan/kost-bu-iin-blok-m-hp-0822493188900-62544.html	kost Bu iin Blok M (hp 0822493188900)	2900000	Kost Campur	Jl Pulo Raya 2 No 5 Kebayoran Baru Jakarta Selatan	Ya	Ya	Ya	Ya	Tidak	Ya	Ya	Tidak	Tidak	Tidak	Tidak	Tidak	Ya	Ya	Tidak	Tidak	Tidak	Tidak	Ya
https://www.sewakost.com/jakarta/selatan/griya-bangka-kost-nyaman-dan-aman-62494.html	Griya  Bangka kost  nyaman dan aman	2000000	Kost Campur	Jl Bangka Raya nom 53 A RT 011 RW 03 Kec PelaMampang Kel Mampang Prapatan Jakarta Selatan	Ya	Ya	Ya	Ya	Ya	Tidak	Ya	Tidak	Ya	Ya	Ya	Ya	Ya	Tidak	Tidak	Ya	Tidak	Tidak	Tidak
https://www.sewakost.com/jakarta/selatan/kost-putri-62388.html	KOST PUTRI	850000	Kost Putri	Jl. Kebagusan 1 Gang Asem No 111, RT/RW 07/07	Ya	Ya	Ya	Tidak	Ya	Tidak	Tidak	Tidak	Tidak	Ya	Tidak	Tidak	Tidak	Tidak	Tidak	Tidak	Tidak	Tidak	Tidak
https://www.sewakost.com/jakarta/selatan/kosan-putri-asri-kekeluargaan-aman-amp-tenang-di-cilandak-kko-62166.html	Kosan Putri, Asri, Kekeluargaan, Aman & Tenang di Cilandak KKO	800000	Kost Putri	Jalan margasatwa barat gg. melati no.25C RT 001 / RW 06, kelurahan Jagakarsa, kecamatan Jagakarsa - Jakarta Selatan 12620 - jakarta selatan	Tidak	Ya	Tidak	Ya	Ya	Tidak	Tidak	Tidak	Ya	Ya	Tidak	Ya	Ya	Tidak	Tidak	Tidak	Tidak	Tidak	Ya
https://www.sewakost.com/jakarta/selatan/kost-di-kebayoran-baru-62336.html	KOST DI KEBAYORAN BARU 	3000000	Kost Campur	JL. ANTENE IV - RADIO DALAM	Ya	Ya	Ya	Ya	Tidak	Ya	Ya	Ya	Ya	Ya	Ya	Ya	Ya	Ya	Ya	Ya	Tidak	Ya	Ya
https://www.sewakost.com/jakarta/selatan/kost-eksklusif-putri-pasar-minggu-omah-eyang-21850.html	Kost Eksklusif Putri Pasar Minggu, Omah Eyang	2300000	Kost Putri	Jl. Karang Pola III No.4, Jati Padang, Pasar Minggu	Ya	Ya	Ya	Ya	Tidak	Tidak	Ya	Tidak	Ya	Ya	Ya	Ya	Ya	Ya	Ya	Ya	Ya	Tidak	Ya
https://www.sewakost.com/jakarta/selatan/kost-pasti-ratu-fasilitas-lengkap-harga-murah-62136.html	Kost Pasti Ratu Fasilitas Lengkap Harga Murah	2300000	Kost Putri	Jln Bambu Kuning No 42 Kebayoran Baru Jakarta Selatan	Ya	Ya	Ya	Ya	Tidak	Tidak	Ya	Tidak	Ya	Ya	Ya	Tidak	Ya	Tidak	Ya	Ya	Tidak	Ya	Tidak
https://www.sewakost.com/jakarta/selatan/kos-h-deddy-mampang-prapatan-xi-62031.html	Kos H. Deddy Mampang Prapatan XI	1200000	Kost Campur	Jl. Mampang Prapatan XI RT. 010/01 No. 38	Tidak	Ya	Ya	Ya	Tidak	Tidak	Tidak	Tidak	Tidak	Ya	Tidak	Tidak	Tidak	Tidak	Tidak	Tidak	Tidak	Tidak	Tidak
https://www.sewakost.com/jakarta/selatan/kos-putri-dian-62028.html	KOS PUTRI DIAN	700000	Kost Putra	Jln Raya lenteng Agung Gg Subur .	Tidak	Tidak	Tidak	Tidak	Tidak	Tidak	Tidak	Tidak	Tidak	Tidak	Tidak	Tidak	Tidak	Tidak	Tidak	Tidak	Tidak	Tidak	Tidak
